HTML Grundlehrgang, http://programming.discudemy.com/html/html-grundlehrgang2019
Python Core and Advanced, http://programming.discudemy.com/python/python-core-and-advanced
Angular: Overcoming Common Obstacles, http://programming.discudemy.com/angular/angular-overcoming-common-obstacles
Introducción a la Programación de Softwaree | Java, http://programming.discudemy.com/java/introduccion-a-la-programacion-de-softwaree-java
Data Scientist Certification Guide For Career Transition, http://programming.discudemy.com/programming-other/complete-career-transition-guide-for-data-science-analytics
C# Najlepsze Praktyki, http://programming.discudemy.com/csharp/c-sharp-najlepsze-praktyki
Introductory To JavaScript - Learn The Basics of JavaScript, http://programming.discudemy.com/javascript/the_complete_javascript_course_for_beginners
Information Systems Concept (Indonesian Version), http://programming.discudemy.com/development-tools/information-concept-system
Como Criar Uma Página de Captura e Gerar Leads No Seu Site, http://programming.discudemy.com/wordpress/como-criar-uma-pagina-de-captura-e-gerar-leads-no-seu-site
Aprenda a Fazer um Jogo 2D sem código em menos de 1 hora, http://programming.discudemy.com/game-development/aprenda-a-fazer-um-jogo-2d-sem-codigo-em-menos-de-1-hora
Uzmanından Ücretsiz Wordpress Eğitimi, http://programming.discudemy.com/wordpress/uzmanindan-ucretsiz-wordpress-egitim-seti
Create WordPress Website with Theme (Basic Training), http://programming.discudemy.com/wordpress/create-wordpress-website-with-theme-basic-training
Minicurso Aprendendo SQL em Oracle, http://programming.discudemy.com/sql/minisqloracle
Python for Everyone, http://programming.discudemy.com/python/python-for-every1
Complete Data Science Masterclass: Beginner to Advanced, http://programming.discudemy.com/programming-other/complete-data-science-course-learn-hands-on-practically
Visual Studio İpuçları& .NET Temelleri Eğitim Videosu Serisi, http://programming.discudemy.com/development-tools/visual-studio-egitim-videosu-serisi
Free Digital Marketing- SEO- Social Media Marketing Course, http://programming.discudemy.com/seo/free-digital-marketing-seo-social-media-marketing-course
Unity Game Development - Build a Basketball Game, http://programming.discudemy.com/game-development/unity-game-developer
How To Get Started On Turo: Hosting 101, http://programming.discudemy.com/development-tools/how-to-host-on-turo
Systemverilog Verification -2: Learning More TB Constructs, http://programming.discudemy.com/programming-other/system_verilog_part_2
SQL Server Crashes and Critical Failures, http://programming.discudemy.com/sql/sql-server-crashes-and-critical-failures
(HATALI PYTHON!) Sıfırdan ileri seviye Pyhton 3, http://programming.discudemy.com/python/hatali-python-sfrdan-ileri-seviye-pyhton-3
Introduction to TypeScript, http://programming.discudemy.com/javascript/typescript
Kendo UI Scheduler, http://programming.discudemy.com/javascript/kendo-ui-scheduler
Web development and design | from Level 0, http://programming.discudemy.com/html/web-development-boot-camp-from-zero-to-hero-darwish
Create & Build Custom Website Without Coding WordPress 2019, http://programming.discudemy.com/wordpress/custom-website-without-coding
Phân tích số liệu với phần mềm R, http://programming.discudemy.com/programming-other/phan-mem-r
C# Automapper: Code Smart, http://programming.discudemy.com/csharp/c-automapper-code-smart
Snowflake Cloud Data Warehouse & Analytics - Introduction, http://programming.discudemy.com/sql/introduction-to-snowflake-cloud-data-warehouse-analytics
RESTFul API With Express Framework Crash Course, http://programming.discudemy.com/nodejs/restful-api-with-express
Ultimate WordPress Package Volume 2, http://programming.discudemy.com/wordpress/ultimate-wordpress-package-volume-2
Shopware Developer Training Advanced - English, http://programming.discudemy.com/e-commerce/shopware-developer-training-advanced-english
CSS و HTML  تطوير واجهات المواقع باستخدام, http://programming.discudemy.com/html/html-css-arabic
Wordpress & Elementor - Als Anfänger wunderschöne Webseiten!, http://programming.discudemy.com/wordpress/wordpress-elementor-kostenlos
Practical Python - Part 4, http://programming.discudemy.com/python/practical-python-part-4
Keyword Research for Top SEO Rankings, http://programming.discudemy.com/seo/keyword-research-for-top-seo-rankings
Easy Game Design with Unity, http://programming.discudemy.com/game-development/easy-game-design-with-unity
Learn Bootstrap: Design a Custom Landing Page in Bootstrap 4, http://programming.discudemy.com/bootstrap/learnbootstrap
JavaScript دليل احتراف لغة, http://programming.discudemy.com/javascript/javascript-arabic
Android: Build a Youtube Listing App Using Kotlin & Parse, http://programming.discudemy.com/android/android-build-a-youtube-listing-app-using-kotlin-parse
Learn To Create A Complete Menu System in Unity, http://programming.discudemy.com/game-development/unitymenus
Crea apps nativas (Android y iOS) con Nativescript "Español", http://programming.discudemy.com/android/crea-apps-nativas-android-y-ios-con-nativescript-espanol
Use Sharepoint as a Requirements Management Tool - No Coding, http://programming.discudemy.com/programming-other/business-analysts-managing-requirements-in-sharepoint
How To Make A Professional Wordpress Website & Free Domain!, http://programming.discudemy.com/wordpress/how-to-make-a-professional-wordpress-website
Learn JavaScript Urdu, http://programming.discudemy.com/javascript/learn-javascript-urdu
Hadoop for Non Java Developers, http://programming.discudemy.com/java/free-hadoop-basics
Start a Streetwear Brand and sell clothing on Shopify, http://programming.discudemy.com/e-commerce/streetwear-brand
Richard Stibbard's "jQuery UI Interfaces" - A mini course, http://programming.discudemy.com/jquery/richard-stibbards-jquery-ui-interfaces
Learn SystemVerilog Assertions and Coverage Coding in-depth, http://programming.discudemy.com/programming-other/learn-system-verilog-assertions-and-coverage
Computer Science and Programming: Beginner JavaScript, http://programming.discudemy.com/javascript/computer-science-and-programming-beginner-javascript
Build a Wordpress Site from Start to Finish, http://programming.discudemy.com/wordpress/build-a-wordpress-site-in-under-30-minutes
Infinite Scroll Project AJAX MySQL API PHP jQuery, http://programming.discudemy.com/php/ajax-project
Create 3D Characters for Games, http://programming.discudemy.com/game-development/create-3d-characters-for-games
HTML & CSS: Build a Dashboard, http://programming.discudemy.com/html/html-css-build-a-dashboard
Ruby on Rails 5 na Prática, http://programming.discudemy.com/ruby/ruby-on-rails-5-na-pratica
libgdx ve java ile Flappy Bird benzeri oyun programlama, http://programming.discudemy.com/game-development/libgdxvejavaileflappybird
Angular: Convierte cualquier template HTML en una WebAPP, http://programming.discudemy.com/angular/html-hacia-angular
wpSEO - WordPress SEO Grundlagen, http://programming.discudemy.com/wordpress/wpseo-wordpress-seo
SEO Tools for Keyword Research - Basics, http://programming.discudemy.com/seo/seo-tools-for-keyword-research-basics
ARM Cortex-M Interfacing with Keyboards and LCD's (FREE! ), http://programming.discudemy.com/robotics/arm-cortex-m-interfacing-with-keyboards-and-lcds
Complete Python Course: Go From Beginner To Advanced, http://programming.discudemy.com/python/complete-python-course-go-from-zero-to-hero
Mobile Multimedia Solution using iOS (Indonesian Version), http://programming.discudemy.com/ios/mobile-multimedia-solution
Crie seu Site em WordPress de forma Fácil e Rápida, http://programming.discudemy.com/wordpress/como-criar-um-site
Curso de HTML5 y CSS3, http://programming.discudemy.com/html/curso-de-html5-y-css3
Load Wordpress 400% Faster without any Technical skills, http://programming.discudemy.com/wordpress/how-to-improve-website-speed-test
Intermediate Android: Jump Scare App Clone In Java, http://programming.discudemy.com/java/shock-app-clone-in-java
Introducción al Desarrollo de Videojuegos con Unity 3D, http://programming.discudemy.com/game-development/introduccion-al-desarrollo-de-videojuegos-con-unity-3d
Python for absolute beginners, http://programming.discudemy.com/python/python_for_absolute_beginners
Como Comprar um Computador Desktop- Notebook ou Tablet, http://programming.discudemy.com/hardware/como-comprar
Storage on Kubernetes - Portworx Fundamentals, http://programming.discudemy.com/development-tools/portworx-fundamentals
Programming for Entrepreneurs - HTML & CSS, http://programming.discudemy.com/html/programming-for-entrepreneurs
Create Your Very Own Author Website, http://programming.discudemy.com/wordpress/create-your-own-author-website-to-attract-1000s-of-new-fans
Mercari Selling Tips [More eCommerce Sales Quicker], http://programming.discudemy.com/e-commerce/mercari-selling-tips-more-ecommerce-sales-quicker
How to become an Android Rock Star, http://programming.discudemy.com/android/lets-rock-it
WordPress for Beginners 2019, http://programming.discudemy.com/wordpress/wordpress-for-beginners-2018
Web Programming untuk Pemula, http://programming.discudemy.com/php/web-programming-wp
Build a Blockchain & Cryptocurrency using Python, http://programming.discudemy.com/python/build-a-blockchain-cryptocurrency-using-python
Ajax en Wordpress para desarrolladores web [Avanzado], http://programming.discudemy.com/wordpress/ajax-para-wordpress
一小時上手 Sublime Text 3 網頁編輯器, http://programming.discudemy.com/development-tools/sublime-text-3
Angular 4 & Todo Uygulaması, http://programming.discudemy.com/angular/angular-4-todo-uygulamasi
Web Design became child's play, http://programming.discudemy.com/web-development-other/web-design-became-childs-play
Learning SEO When Short On Time, http://programming.discudemy.com/seo/learning-seo-when-short-on-time
DevOps Series - Server Automation using Ansible, http://programming.discudemy.com/development-tools/devops-series-server-automation-using-ansible
Create- Manage & Customize your OnLine Store by Bigcommerce, http://programming.discudemy.com/web-development-other/create-manage-customize-your-online-store-by-bigcommerce
Get started Creating Websites Everything you need provided, http://programming.discudemy.com/web-development-other/get-started-creating-websites-everything-you-need-provided
Lets Learn Python, http://programming.discudemy.com/python/lets-learn-python-s
Laravel homestead Improved per php 7, http://programming.discudemy.com/php/laravel-homestead-improved-laravel-php
Como usar el componente Sound, http://programming.discudemy.com/development-tools/como-usar-el-componente-sound-sin-morir-en-el-intento
Angular: Compelling Demos, http://programming.discudemy.com/angular/angular-compelling-demos
Fun and creative web engineering with Python and Web2py, http://programming.discudemy.com/python/web-engineering-with-python-and-web2py
8 Beautiful Ruby on Rails Apps in 30 Days & TDD - Immersive , http://programming.discudemy.com/ruby/8-beautiful-ruby-on-rails-apps-in-30-days
PHONEGAP CRASH COURSE: Learn Mobile App Development, http://programming.discudemy.com/mobile-development-other/free-phonegap-crash-course-learn-to-build-mobile-application
Criando Páginas Web com o GitHub Pages, http://programming.discudemy.com/git/github-pages
Apprendre HTML5 et CSS3 : Les bases [1/2], http://programming.discudemy.com/html/apprendre-html5-et-css3-les-bases-1-sur-2
Learn CSS Basics, http://programming.discudemy.com/css/css-in-one-hour
How to quickly create a Discord bot, http://programming.discudemy.com/nodejs/how-to-quickly-create-a-discord-bot
Getting Started as a Web Developer, http://programming.discudemy.com/html/refactoru-getting-started-as-a-web-developer
Shopify Beginner Courses by diff, http://programming.discudemy.com/e-commerce/shopify-beginner-courses-by-diff
10x Engineer: What? You can do that on Cisco IOS?, http://programming.discudemy.com/ios/cisco-devnet-associate-ccna
Java Básico desde Cero, http://programming.discudemy.com/java/java-basico-desde-cero-gratis
Build a simple messages board with php7 for beginner, http://programming.discudemy.com/php/build-a-simple-messages-board-with-php7-for-beginner
Oyun Modeli Tasarlama, http://programming.discudemy.com/game-development/oyun-modeli-tasarlama
Introduzione a Python, http://programming.discudemy.com/python/introduzione-a-python
DevOps: Beginner's Guide To Automation With Ansible, http://programming.discudemy.com/development-tools/devops-beginners-guide-to-automation-with-ansible
C programlama Temel Programlar, http://programming.discudemy.com/c/c-programlama-temel
Introduction To Parallel Test Execution with Selenium, http://programming.discudemy.com/debug-test/parallel-test-execution
Beginner course to Learn Client-Side JavaScript, http://programming.discudemy.com/javascript/beginner-course-to-learn-client-side-javascript
Aprende Accesibilidad Web paso a paso, http://programming.discudemy.com/ios/aprende-accesibilidad-web-paso-a-paso
Unity game development- make games in just 4 hours, http://programming.discudemy.com/game-development/how-to-make-hypercasual-io-games-in-unity
Python 3.7 Bootcamp| Beginner to Intermediate level | A to Z, http://programming.discudemy.com/python/python-from-absolute-beginner-to-intermediate-level-a-to-z
Java SE - Polimorfismo, http://programming.discudemy.com/java/java-se-polimorfismo
Complete JavaScript Course: Beginner to Advance, http://programming.discudemy.com/javascript/complete-javascript-course-beginner-to-advance-k
Beginner's Guide to Containers and Orchestration, http://programming.discudemy.com/development-tools/linux-academy-beginners-guide-to-containers-and-orchestration
Bootstrap Migrating from previous versions, http://programming.discudemy.com/bootstrap/new-bootstrap
The Complete Android Oreo(8.1) - N -M and Java Development, http://programming.discudemy.com/android/the-complete-android8-oreo-nougat-m-java-development
Master MongoDB- the NOSQL leader with Clarity and Confidence, http://programming.discudemy.com/nosql/learn-mongodb-the-nosql-leader-with-clarity-and-confidence
Automate everything with Katalon Studio, http://programming.discudemy.com/android/katalon-studio
The Course for the Basics of kotlin programming language, http://programming.discudemy.com/android/the-course-for-the-basics-of-kotlin-programming-language
Wordpress For Beginners - Create A Pro Site Fast and Easy, http://programming.discudemy.com/wordpress/wordpress-for-beginners-create-a-pro-site-in-30-minutes
Graph: Pengantar Disjoint Set & Minimum Spanning Tree, http://programming.discudemy.com/programming-other/graph-introduction-to-disjoint-set-and-minimum-spanning-tree
Beginner PHP and MySQL Tutorial, http://programming.discudemy.com/php/php-mysql-tutorial
Introduction to SQL Using TeamSQL, http://programming.discudemy.com/sql/introduction-to-sql-using-teamsql
Rapid Website Design with Bootstrap, http://programming.discudemy.com/bootstrap/responsive-website-design
Getting Started with BlazeMeter, http://programming.discudemy.com/development-tools/getting-started-with-blazemeter
WordPress Training for Beginners, http://programming.discudemy.com/wordpress/learn-wordpress-from-scratch-for-beginners
WebServices / REST API Testing Automation: via SoapUI, http://programming.discudemy.com/debug-test/webservices-automation-using-soapui
Build Your Own WebServer For Multiple Websites On The Cloud, http://programming.discudemy.com/development-tools/build-your-webserver-on-the-cloud
Tutorial membuat Game Endless Running menggunakan Unity, http://programming.discudemy.com/game-development/creating-endless-running-game-in-unity
Mobile App Development in 27 Minutes: iOS App, http://programming.discudemy.com/ios/iso-app-development-tutorial-in-27-minutes
PLC-yə giriş, http://programming.discudemy.com/hardware/plc-y-giris
Beginner HTML and CSS, http://programming.discudemy.com/html/beginner-html-and-css
Aprende programación básica con PHP, http://programming.discudemy.com/php/aprende-programacion-basica-con-php
零基础玩转高并发图片爬虫, http://programming.discudemy.com/python/img-spider
JavaScript Essentials 2019 Mini Course, http://programming.discudemy.com/javascript/javascript-essentials-mini-course
Learn the Unity 3D Shuriken Particle System, http://programming.discudemy.com/game-development/learn-the-unity-3d-shuriken-particle-system
What is new in C# 6, http://programming.discudemy.com/csharp/what-is-new-in-csharp-6
How To Make A Beautiful WordPress Website | FREE Domain!, http://programming.discudemy.com/wordpress/how-to-make-a-beautiful-wordpress-website
Introducción a SQL con Oracle 11g, http://programming.discudemy.com/sql/introduccion-a-sql-con-oracle-11g
Como Crear un CRUD con PHP y SQL Server, http://programming.discudemy.com/php/como-crear-un-crud-con-php-y-sql-server
Getting Started with Java, http://programming.discudemy.com/java/java-development-environment
Membangun Cross Platform Apps menggunakan QT 5 untuk Pemula, http://programming.discudemy.com/programming-other/cross-platform-application-development
Curso completo de Wordpress y Woocoommerce, http://programming.discudemy.com/wordpress/curso-completo-de-wordpress-y-woocoommerce
Sistema de Login en Visual Basic y SQL Server en Capas, http://programming.discudemy.com/csharp/login-vb-sql
Git: Become an Expert in Git & GitHub in 4 Hours, http://programming.discudemy.com/git/git-expert-4-hours
Learning Microsoft Azure Step by Step Part 1, http://programming.discudemy.com/development-tools/maruti-microsoft-azure-step-by-step-part-1
New FileMaker 18 Features, http://programming.discudemy.com/programming-other/new-filemaker-18-features
Benefits of Thinking Mobile First Future of Website Design, http://programming.discudemy.com/web-development-other/thinking-mobile-websites-smart-design-tutorial
Pengantar Object Oriented Programming with Java Untuk Pemula, http://programming.discudemy.com/java/object-oriented-programming-with-java-oop
Angular: ASP.Net Core Overview, http://programming.discudemy.com/nodejs/angular-letting-nodejs-do-the-heavy-lifting
Baseball Database Queries with SQL and dplyr, http://programming.discudemy.com/sql/baseball1
Create a 3-Tier Application Using Azure Virtual Machines, http://programming.discudemy.com/development-tools/free-azure
How to Develop Like A Pro With Buildbox 2, http://programming.discudemy.com/game-development/develop-like-a-pro-with-buildbox-2
Cloning Amazon- Netflix & Spotify, http://programming.discudemy.com/html/learn-html-css-clone-amazon-netflix-spotify
Advanced Android: Create a Real-REST API Client Application, http://programming.discudemy.com/android/advanced-android-development
30 Yaşından Sonra Programlama, http://programming.discudemy.com/java/30-yasindan-sonra-programlama
RedRabbit Inspections & Maintenance A to Z, http://programming.discudemy.com/development-tools/redrabbit-inspections-maintenance-a-to-z
React vs Angular vs Vue.js by Example, http://programming.discudemy.com/javascript/react-vs-angular-vs-vuejs-by-example
Wordpress para Iniciantes, http://programming.discudemy.com/wordpress/criar-blog-wordpress-para-iniciantes
Notificações Push com Firebase, http://programming.discudemy.com/development-tools/push-firebase
Developing Database Application using Spring MVC and MyBatis, http://programming.discudemy.com/java/developing-database-application-using-spring-mvc-and-mybatis
The Complete Swift 4 Bootcamp, http://programming.discudemy.com/ios/learnswift
Build WordPress Website - انشاء مدونة عربية على الووردبريس, http://programming.discudemy.com/wordpress/create-arabic-wordpress-website
Learn How to Design & Build a WordPress Website in 2020!, http://programming.discudemy.com/wordpress/learn-how-to-design-build-a-wordpress-website
Conheça o Oracle Data Integrator(ODI) 12c FREE, http://programming.discudemy.com/sql/conheca-oracle-data-integrator-odi-12c
Build A WordPress Website from Home, http://programming.discudemy.com/wordpress/step-by-step-guide-for-building-a-website
WordPress Plugins: Unleash the power of free plugins 2018, http://programming.discudemy.com/wordpress/wordpress-free-plugins-course
PROBAR DJANGO | Crear una Aplicación Web, http://programming.discudemy.com/django/probar-django-construir-una-aplicacion-web-en-python
JavaScript Basics for Everyone Part 1, http://programming.discudemy.com/javascript/javascript-basics-for-everyone-part-1
8051 Microcontroller, http://programming.discudemy.com/hardware/the-8051-microcontroller
Shopware User Training, http://programming.discudemy.com/development-tools/shopware-user-training
Complete Python Course: Go From Beginner To Expert, http://programming.discudemy.com/python/the-complete-python-course-go-from-beginner-to-expert-
Wordpress Desde Cero - Nivel Básico e Intermedio, http://programming.discudemy.com/wordpress/curso-basico-de-wordpress
Microsoft SQL Server 2014 Database Administration, http://programming.discudemy.com/sql/microsoft-sql-server-2014-database-administration
SAP PO: Learn to Configure Java and SAP NWDS Software, http://programming.discudemy.com/programming-other/sap-po-learn-to-configure-java-and-sap-nwds-software
Erfolgreich in den E-Commerce starten mit JTL Software, http://programming.discudemy.com/e-commerce/erfolgreich-in-den-e-commerce-starten-mit-jtl-software
Uploading & Exporting With Buildbox, http://programming.discudemy.com/game-development/uploading-exporting-with-buildbox
Programming for Kids - How to Make Coding Fun, http://programming.discudemy.com/programming-other/programming-for-kids-how-to-make-coding-fun
Microsoft SQL Server- Getting Started on Mac and Windows, http://programming.discudemy.com/sql/microsoft-sql-server-getting-started-on-mac-and-windows
Con Trello organiza tus proyectos de forma profesional, http://programming.discudemy.com/development-tools/trello-en-espanol
One Page WordPress Website For Beginners, http://programming.discudemy.com/wordpress/One-page-wordpress-website-for-beginners
Make Sublime Coders Friendly, http://programming.discudemy.com/development-tools/sublime-text-editor-rapid-development-amazing-plugins
⭐️⭐️ Luźny kurs SEO ☝✅, http://programming.discudemy.com/seo/luzny-kurs-seo
Beginning Oracle WebLogic for Administrators, http://programming.discudemy.com/sql/learn-oracle-weblogic-12c-essentials
Arduino Workshop 2018 | A step-by-step Arduino how-to guide, http://programming.discudemy.com/robotics/arduino-workshop-step-by-step-guide
Wordpress Metabox Tutorial for beginners with Live Coding, http://programming.discudemy.com/wordpress/wordpress-metabox-tutorial
ELZERO IOS 11#SWIFT 4 (34 APPS ) الشرح الوافي برمجه الايفون, http://programming.discudemy.com/ios/elzero-ios-11swift-4-34-apps
Practical SAS Visual Analytics, http://programming.discudemy.com/css/practical-sas-visual-analytics
SAP TERP10 course 1, http://programming.discudemy.com/programming-other/sapterp10series1
Javascript For Beginners, http://programming.discudemy.com/javascript/javascript-for-beginners-m
Getting Started with Apache Ambari, http://programming.discudemy.com/development-tools/getting-started-with-apache-ambari
Android Piano App Development Course for Beginners, http://programming.discudemy.com/android/android-piano-app-development-course-for-beginners
Testes Unitários em Java Utilizando o JUnit, http://programming.discudemy.com/java/testes-unidade-automaticos-software-junit
Angular 2 Routing: Up And Running, http://programming.discudemy.com/angular/angular-2-routing-up-and-running
Lambda Expressions -> Java, http://programming.discudemy.com/nodejs/java-8-functional-programming-with-lambda-expression
Web Development - Complete Fast Track Course (2019), http://programming.discudemy.com/php/web-development-fast-track
Introdução ao 2D Game Kit do Unity, http://programming.discudemy.com/game-development/introducao-2d-game-kit-unity
Laravel 5 - تعلم برمجة المواقع بسهولة باستخدام لارافل, http://programming.discudemy.com/php/laravel5-iqtech
WordPress for Beginners Course Create a Website Step by Step, http://programming.discudemy.com/wordpress/wordpress-for-beginners-coursecreate-a-website-step-by-step
Angular Authentication - Mastering the Basics, http://programming.discudemy.com/angular/angular-authentication-tutorial-mastering-the-basics
PayPalでオンラインコースを販売する方法 - 継続課金と分割決済の導入ガイド付き, http://programming.discudemy.com/development-tools/paypal-and-credit-card-payment
Conhecendo a Área de Jogos Digitais, http://programming.discudemy.com/programming-other/conhecendo-a-area-de-jogos-digitais
Java Database Connection: JDBC and MySQL, http://programming.discudemy.com/java/how-to-connect-java-jdbc-to-mysql
Wie man eine Homepage oder einen Blog mit WordPress erstellt, http://programming.discudemy.com/wordpress/wie-erstelle-ich-eine-homepage-oder-einen-blog-mit-wordpress
Deploying Android Apps to Different App Stores - Correctly!, http://programming.discudemy.com/android/deploying-android-apps-to-different-app-stores-correctly
Express course - Develop Web Apps/SaaS with PHP and ATK, http://programming.discudemy.com/php/web-apps-with-php-and-atk
Learn SAP PO REST- JSON and API Basics, http://programming.discudemy.com/programming-other/free-course-on-sap-po-rest-json-and-api-basics
Learn HTML5 and CSS3, http://programming.discudemy.com/html/html5-css3-the-right-parts-complete-beginners-course
Tudo sobre WordPress, http://programming.discudemy.com/wordpress/tudo-sobre-wordpress
Virtual Machine full localhost LAMP stack setup in minutes, http://programming.discudemy.com/wordpress/virtual-machine-full-localhost-lamp-stack-setup-tutorial
Introduction to JavaScript Development, http://programming.discudemy.com/javascript/refactoru-intro-js
