Setup Google Office Online with Bluehost- Wordpress- G Suite, http://programming.discudemy.com/development-tools/set-up-your-office-in-the-cloud
Swift and XCode دورة أساسيات البرمجة بلغة سويفت, http://programming.discudemy.com/ios/swift3-and-xcode8-arabic
Introdução ao jQuery, http://programming.discudemy.com/javascript/introducao-jquery
Create a WordPress Website for Your Web Design Business, http://programming.discudemy.com/wordpress/create-wordpress-website-for-your-web-design-business
Crea tu terreno con un Heightmap en Unity 3D, http://programming.discudemy.com/game-development/crea-tu-terreno-con-un-heightmap-en-unity-3d
Getting Started with Raspberry Pi, http://programming.discudemy.com/robotics/getting-started-with-raspberry-pi
Sıfırdan One Page Cv Scripti Kodluyoruz, http://programming.discudemy.com/php/kolay-projelerden-zor-projelere-dogru-ustalasma-zamani
Authoring reliable code with Nunit, http://programming.discudemy.com/programming-other/nunit123
Web Development By Doing: HTML / CSS From Scratch, http://programming.discudemy.com/html/web-development-learn-by-doing-html5-css3-from-scratch-introductory
WordPress Basics: Learn WordPress in one hour!, http://programming.discudemy.com/wordpress/wordpress-basics-learn-wordpress-in-one-hour
PLC Programming 100, http://programming.discudemy.com/robotics/plc-programming-100
Python 3 and Leather Data Visualization, http://programming.discudemy.com/python/python3-leather-data-visualization
Learn Core Python- Numpy and Pandas, http://programming.discudemy.com/python/learn-core-python-numpy-and-pandas
FREE 60 Minute Scrum Course, http://programming.discudemy.com/development-tools/free-60-minute-scrum-course
Git tutorials for Beginners - Complete Course, http://programming.discudemy.com/git/gitandgithub
Ionic 3 para iniciantes, http://programming.discudemy.com/mobile-development-other/ionic-3-para-iniciantes
HTML5 Mobile Game Development by Example - Educational Game, http://programming.discudemy.com/game-development/html5-game-development-tutorial
Fundamentals of IoT Development with ThingWorx Version 7.4, http://programming.discudemy.com/development-tools/thingworx-fundamentals
Complete Python Course: Learn Hands On Practically, http://programming.discudemy.com/python/complete-python-course-learn-hands-on-practically
Build Your First iOS App with Apple's Swift and Xcode, http://programming.discudemy.com/ios/build-your-first-ios-app-with-apples-swift-and-xcode
ASP.NET Zero: Development with ASP.NET Core & Angular, http://programming.discudemy.com/csharp/aspnet-zero-aspnet-core-angular
HTML and CSS for Absolute Beginners, http://programming.discudemy.com/html/html-and-css-for-absolute-beginners-with-examples
ALM  with  PTC Integrity Lifecycle Management, http://programming.discudemy.com/programming-other/application-lifecycle-management-with-ptc-integrity
Complete UiPath Bootcamp For Absolute Beginners, http://programming.discudemy.com/development-tools/complete-uipath-bootcamp-for-absolute-beginners
learn php programming -Urdu, http://programming.discudemy.com/php/learn-php-programming-urdu
Wordpress Custom Post Type Tutorial with Live Coding, http://programming.discudemy.com/wordpress/wordpress-custom-post-type-tutorial
Functions and Closures in Swift, http://programming.discudemy.com/ios/functional-programming-in-swift
Como Crear Una Pagina Web o Blog con WordPress en 2 horas., http://programming.discudemy.com/wordpress/como-crear-una-pagina-web-o-blog-con-wordpress
Building no-code apps on bubble for newbies by Zeroqode Lab, http://programming.discudemy.com/web-development-other/how-to-build-apps-without-code-on-bubble-beginners-guide
WordPress in under an hour - Create/manage your own website!, http://programming.discudemy.com/wordpress/learn-wordpress-in-57-minutes
Beginner's Guide to Flask Web Framework, http://programming.discudemy.com/programming-other/beginners-guide-flask-web-framework
Software E3.series para Diseño de Esquemas Eléctricos, http://programming.discudemy.com/ios/fundamentos-en-e3series
Aprende Swift y SpriteKit con el juego piedra papel o tijera, http://programming.discudemy.com/ios/aprende-swift-y-spritekit-con-el-juego-piedra-papel-o-tijera
Como fazer um site Wordpress usando o Tema Divi 3.0, http://programming.discudemy.com/wordpress/como-fazer-um-site-wordpress-usando-o-tema-divi-30
The Beginning Guide to Microsoft Access 2013, http://programming.discudemy.com/sql/the-beginning-guide-to-microsoft-access-2013
Что такое Тестирование ПО? Как и куда развиваться?, http://programming.discudemy.com/debug-test/software-testing-demo
Introduction to programming with Java, http://programming.discudemy.com/java/introduction-to-programming-with-java
[NEW] Functional programming for javascript developers, http://programming.discudemy.com/javascript/functional-programming-for-javascript-developers
PHP ilə Blog websaytınızı yaradın.(Bootstrap- Phpmyadmin), http://programming.discudemy.com/php/php-ile-blog-websaytiniz-yaradin-create-your-blog
Penetration Testing Android In Arabic, http://programming.discudemy.com/android/penetration-testing-android-in-arabic-level-1
Unreal Engine 4 Essentials - Uma Introdução Detalhada, http://programming.discudemy.com/game-development/unreal-engine-introducao
Learn how to quickly build websites using Wordpress, http://programming.discudemy.com/wordpress/learn-how-to-quickly-build-websites-using-wordpress
SEO Training Course by Moz, http://programming.discudemy.com/seo/whiteboard-seo
Ultimate Python Course : Go From Zero To Hero, http://programming.discudemy.com/python/ultimate-python-course-go-from-zero-to-hero
Complete Python Course: Beginner to Advance, http://programming.discudemy.com/python/complete-python-course-beginner-to-advance
Basic of unity, http://programming.discudemy.com/game-development/basic-of-unity
Database Management Systems - MySQL, http://programming.discudemy.com/sql/database-management-systems-mysql
Data Structures Concepts & Singly Linked List Implementation, http://programming.discudemy.com/data-structure/data-structures-in-c
Python Data Structures A to Z, http://programming.discudemy.com/python/python-data-structures-a-to-z
Essential SEO Training For Online Marketing, http://programming.discudemy.com/seo/essential-seo-training-for-online-marketing
JavaScript Basics for Everyone Part 2, http://programming.discudemy.com/javascript/javascript-basics-for-everyone-part-2
Python Basics - Bootcamp, http://programming.discudemy.com/python/python-basics-bootcamp
The Unity Workshop, http://programming.discudemy.com/game-development/the-unity-workshop
Curso de Design Responsivo, http://programming.discudemy.com/html/curso-de-design-responsivo
iOS 11 iPhone Apps開發極速入門班（普通話授課）, http://programming.discudemy.com/ios/ios11-apps-dev-intro-zh
SAP Business One - Parceiros de Negócios, http://programming.discudemy.com/programming-other/sap-business-one-parceiros-de-negocios
Rapid Prototyping with Ionic: Build a Data-Driven Mobile App, http://programming.discudemy.com/mobile-development-other/learn-ionic-framework-build-a-stock-market-mobile-app
أساسيات التحكم الصناعي, http://programming.discudemy.com/hardware/automationconnect
Fundamentals of the MarkLogic NoSQL Database, http://programming.discudemy.com/nosql/marklogic-fundamentals
Local Development Environments for Web Design, http://programming.discudemy.com/html/local-development-environments-for-web-design
LoRaWAN Nedir, http://programming.discudemy.com/hardware/lorawan-nedir
Fun with Beginner LEGO MindStorms EV3 Robotics., http://programming.discudemy.com/robotics/fun-with-beginner-lego-mindstorms-ev3-robotics
SEO i Pozycjonowanie stron www dla początkujących, http://programming.discudemy.com/seo/podstawy-seo-pozycjonowania-i-marketingu-online
സി പ്രോഗ്രാമിങ് ട്യൂട്ടോറിയൽസ്, http://programming.discudemy.com/c/online-c-language-classes-in-malayalam
Learn How to Craft Game Effects using Houdini & UE4, http://programming.discudemy.com/game-development/game-effects-using-houdini-ue4
Aprende Programación con Diagramas de Flujo, http://programming.discudemy.com/programming-other/programacion-desde-cero-con-diagramas-de-flujo
AskDjango 와 함께 장고걸스 튜토리얼 따라하기 ( django- 장고 ) - Free, http://programming.discudemy.com/django/djangogirls-with-askdjango
MS-DOS Basics from scratch, http://programming.discudemy.com/development-tools/ms-dos-basics
WordPress for Beginners (Step by Step Guide), http://programming.discudemy.com/wordpress/wordpress-for-beginners-step-by-step-guide
Youtube SEO Course To Rank On First Page : Unlimited Views, http://programming.discudemy.com/seo/youtube-seo-course-to-rank-on-first-page-unlimited-views
Android Fundamentals: Ultimate Tutorial for App Development, http://programming.discudemy.com/android/ultimate-android-lollipop-app-development-course
Oracle Database Performance Tuning - Fundamentals, http://programming.discudemy.com/sql/oracle-database-performance-tuning-fundamentals
Unity 2019 Multiplayer Oyun Tasarlama, http://programming.discudemy.com/game-development/photonnetwork-ile-unity-de-multiplayer-oyun-tasarlama
Pure JavaScript Calculator - JavaScript to the max, http://programming.discudemy.com/javascript/javascript-code-exercise
Apprendre à créer des sites professionnels avec HTML5 et CSS, http://programming.discudemy.com/html/apprendre-a-creer-des-sites-professionnels-avec-html5-et-css
A-Z Temel WORDPRESS Eğitimi ÜCRETSİZ!!, http://programming.discudemy.com/wordpress/a-z-wordpress-egitimi-ucretsiz
HTML and CSS - Lets Build a Mixer Clone, http://programming.discudemy.com/html/html-and-css-lets-build-a-mixer-clone
A narrativa nos jogos de videogame, http://programming.discudemy.com/game-development/a-narrativa-nos-jogos-de-videogame
Big Data and Hadoop Essentials, http://programming.discudemy.com/nosql/big-data-and-hadoop-essentials-free-tutorial
DevOps : CI/CD with Jenkins, http://programming.discudemy.com/development-tools/devops-cicd-with-jenkins
HTML 5 y CSS 3 - Paso a paso y Práctico - Crea sitios web!, http://programming.discudemy.com/html/curso-html5-css3
HTML Essentials: Crea tu página web con HTML, http://programming.discudemy.com/html/html-essentials-crea-tu-pagina-web-con-html
HTML: The first step for absolute beginners, http://programming.discudemy.com/html/html-the-first-step-for-absolute-beginners
Symfony 3 en producción - Subir y publicar proyectos web, http://programming.discudemy.com/web-development-other/symfony-3-en-produccion-subir-y-publicar-proyectos-web
Aprendendo Swift do Iniciante ao Avançado. (Mac e Windows), http://programming.discudemy.com/ios/aprendendoswift3
30個のおすすめWordPressプラグインの使い方を200個の中から厳選してご紹介, http://programming.discudemy.com/wordpress/wordpress-plugin30
VS Code: Produtividade Infinita Back-End Web + [EBOOK FREE], http://programming.discudemy.com/development-tools/vscode-backend
PHP Mysql CRUD Tutorial in Hindi, http://programming.discudemy.com/php/php-mysql-crud-tutorial-in-hindi
Inference Solutions Certified Associate, http://programming.discudemy.com/development-tools/inference-solutions-certified-associate
Selenium WebDriver with Java, http://programming.discudemy.com/debug-test/selenium-webdriver-with-java
JavaScript for QA Engineers and SDETs, http://programming.discudemy.com/javascript/javascript-for-qa-engineers-and-sdets
WordPress- SEO- Website for beginners: Get results quickly !, http://programming.discudemy.com/wordpress/fast-learn-wordpress-and-build-up-your-own-online-website
Aprende a crear tu propio correo con PHP7- MySQL- Html5, http://programming.discudemy.com/php/php-mail
Vertical Scroll Arrangement, http://programming.discudemy.com/development-tools/vertical-scroll-arrangement
Como migrar Wordpress y no morir en el intento, http://programming.discudemy.com/wordpress/como-migrar-wordpress-y-no-morir-en-el-intento
Real World SQL Server From The Ground Up, http://programming.discudemy.com/sql/real-world-sql-server-from-the-ground-up
The Complete Python Course: Go From Zero To Hero, http://programming.discudemy.com/python/the-complete-python-course-go-from-zero-to-hero
Herramientas para el desarrollador web, http://programming.discudemy.com/html/herramientas-para-el-desarrollador-web
Curso de Virtualbox Practico y Desde Cero, http://programming.discudemy.com/ios/curso-de-virtualbox-practico-y-desde-cero
Beginners Guide to Dependency Injection for C# Developers, http://programming.discudemy.com/csharp/injection-intro
Try Django 1.10 | Create a URL Shortening Service, http://programming.discudemy.com/django/try-django-1-10
Learn web Design using html and css, http://programming.discudemy.com/html/learn-web-design-using-html-and-css
Banco de Dados com Firebase, http://programming.discudemy.com/android/database-firebase
2小時成為Android開發者（普通話授課）, http://programming.discudemy.com/android/android-intro-zh
Python para Iniciantes, http://programming.discudemy.com/python/python-para-iniciantes
C++: Orientação a Objetos - Introdução, http://programming.discudemy.com/cpp/orientacao-a-objetos-c
Unit Test Yazma Sanatı, http://programming.discudemy.com/development-tools/unit-test-yazma-sanati
iOS 9 und Swift 2.0 Einsteiger Kurs, http://programming.discudemy.com/ios/ios-9-und-swift-20-einsteiger-kurs
Seria Web Developer - część 3 - Portal Randkowy - Prolog., http://programming.discudemy.com/angular/portal-randkowy-prolog
Automate WebServices Rest API (testing) using Java, http://programming.discudemy.com/java/automate-webservices-rest-api-testing-using-java
Vehicle Modeling in Houdini 16.5 - SciFi Dropship, http://programming.discudemy.com/programming-other/vehicle-modeling-in-houdini-16-scifi-dropship
Java Programming(Methods):basics for beginners, http://programming.discudemy.com/java/java-methods
ButterKnife para desarrollo Android [2019], http://programming.discudemy.com/android/todo-sobre-butter-knife-para-android-con-kotlin-y-java
Wordpress:Quick And Easy Video Tutorial Series for Beginners, http://programming.discudemy.com/wordpress/wordpressquick-and-easy-video-tutorial-series-for-beginners
Complete Python Masterclass: Go From Beginner To Advanced, http://programming.discudemy.com/python/complete-python-masterclass-go-from-beginner-to-advanced
iPhone İçin Chat Uygulaması UI Tasarımı, http://programming.discudemy.com/ios/iphone-icin-chat-uygulamas-ui-tasarm
Programming 101, http://programming.discudemy.com/programming-other/programming-101
Shopify Desenvolvimento de Templates, http://programming.discudemy.com/e-commerce/shopify-desenvolvimento-de-templates
Build Your First Glass Web App Theme With HTML5 And CSS3, http://programming.discudemy.com/html/build-your-first-glass-web-app-theme-with-css3-and-html5
SEO Your Resume: Bypass HR with Keyword Optimization, http://programming.discudemy.com/seo/seo-your-resume
Create A Website For Free. Free Domain|Free hosting, http://programming.discudemy.com/wordpress/learn-to-create-a-website-for-free-free-domainfree-hosting
Complete Javascript Course: Go from beginner to advanced, http://programming.discudemy.com/javascript/complete-javascript-course-go-from-beginne-to-advanced
Create Your Own Travel Blog like a Pro, http://programming.discudemy.com/wordpress/create-pro-travel-blog
Aprende a crear tu página web con Wordpress, http://programming.discudemy.com/wordpress/aprende-a-crear-tu-pagina-web-con-wordpress
Wordpress: Crea una página web desde cero -2019 Curso básico, http://programming.discudemy.com/wordpress/wordpress-crea-una-pagina-web-desde-cero-curso-basico
Learn Angular 4 from Scratch, http://programming.discudemy.com/angular/learn-angular-from-scratch
Learn the Building Blocks of Python for Absolute Beginners, http://programming.discudemy.com/python/python-fundamental-basics
Learn to Program in Javascript: Beginner to Pro, http://programming.discudemy.com/javascript/programming-in-javascript
Programming an average forum using PHP, http://programming.discudemy.com/php/forum-forum
週末に体験するMetaTrader4プログラミング, http://programming.discudemy.com/development-tools/metatrader4-o
Spring Boot : Complete guide from development to deployment, http://programming.discudemy.com/java/spring-boot-complete-guide-from-development-to-deployment
SAP Conceptos e iniciación, http://programming.discudemy.com/programming-other/sap-conceptos-e-iniciacion
Linux para Principiantes, http://programming.discudemy.com/ios/linux-para-principiantes-1
Getting interview ready - data structures, http://programming.discudemy.com/data-structure/getting-interview-ready-data-structures
Become a HTML and CSS Developer - Build a Responsive Site, http://programming.discudemy.com/html/learn-to-code-in-html-and-css
Real Time Chat With Laravel Broadcast- Pusher and Vuejs, http://programming.discudemy.com/php/laravel-real-time-chat-with
Python for Beginners: Learn with Examples and Mini-Project, http://programming.discudemy.com/python/technobytes-python-for-beginners
Build eCommerce and Brand Sites to Start Working from Home, http://programming.discudemy.com/wordpress/build-ecommerce-and-brand-sites-beginner-working-from-home
Java ile Programlama, http://programming.discudemy.com/java/java-ile-programlama
AWS：はじめてのAmazon Web Services, http://programming.discudemy.com/wordpress/aws-for-beginner
Create Google Homepage with HTML and CSS in just 40 mins, http://programming.discudemy.com/html/create-google-homepage-with-html-and-css-in-just-40-mins
Understand Oracle ASM Fundamentals, http://programming.discudemy.com/sql/oracle-asm-fundamentals
Créez un Serveur Web et Site Wordpress pas-à-pas - Débutants, http://programming.discudemy.com/wordpress/creez-un-serveur-web-et-site-wordpress-pas-a-pas-debutants
Lập trình C# và lập trình game với Unity cơ bản, http://programming.discudemy.com/csharp/khoa-hoc-lap-trinh-c-sharp-co-ban-den-nang-cao
非エンジニアでも学べるPHP入門講座, http://programming.discudemy.com/php/techacademy-php
Quick Windows [Win8] App Development - For Busy People Only, http://programming.discudemy.com/mobile-development-other/quick-win8-app-development-for-busy-people-only
Dropshipping avec Shopify et Facebook Ads, http://programming.discudemy.com/e-commerce/dropshipping-avec-shopify-et-facebook-ads
Introducción a DEMs con QGIS, http://programming.discudemy.com/development-tools/presas-con-qgis
Docker for beginners, http://programming.discudemy.com/development-tools/docker-for-beginners
Learn How to Quickly Build a Website for Your Business, http://programming.discudemy.com/web-development-other/create-build-a-website-for-your-business-hobby-blog
Essentials of Data Science, http://programming.discudemy.com/programming-other/essentials-of-data-science-in-90-minutes
Groovy | Step by Step for Beginners, http://programming.discudemy.com/programming-other/groovy-step-by-step-for-beginners
SAP ABAP Iniciación a la programación, http://programming.discudemy.com/programming-other/sap-abap-iniciacion-a-la-programacion
Diseño Web - Aprende creando un sitio web paso a paso, http://programming.discudemy.com/html/diseno-web-aprende-creando-un-sitio-web
Curso de WordPress Gratuito [2019 atualizado], http://programming.discudemy.com/wordpress/curso-de-wordpress-gratuito-2019-atualizado
Создание сайта- блога бесплатно на платформе WordPress COM, http://programming.discudemy.com/wordpress/wordpress-com
Codeigniter ile Profesyonel Blog Uygulaması Geliştiriyoruz, http://programming.discudemy.com/php/ci-blog-app
Complete java Course: Go from beginne to advanced, http://programming.discudemy.com/java/complete-java-course-go-from-beginne-to-advanced
Wprowadzenie do Git i GitHub, http://programming.discudemy.com/javascript/kurs-git-i-github-od-podstaw
The Internet & Website (English Version), http://programming.discudemy.com/wordpress/new-media-w
Laravel Query Builder, http://programming.discudemy.com/php/laravel-query-builder
Bilgisayar Bilimi Dersini Python ile Zenginleştirin!, http://programming.discudemy.com/python/bilgisayar-bilimi-icin-python
RESTful Web Services with Spring Framework - A quick start, http://programming.discudemy.com/java/restful-web-services-with-spring-framework-a-quick-start
صمم موقعك في أقل من ٦٠ دقيقه, http://programming.discudemy.com/development-tools/make-a-website-in-less-than-60min-arabic
Free SEO Training Course 2020: Rank your website in Google., http://programming.discudemy.com/seo/free-seo-training-course-rank-your-website-in-google
Java Basic: GUI and MVC, http://programming.discudemy.com/java/java-gui-mvc
HTML Introduction Course: Learn HTML in 2 hours!!!, http://programming.discudemy.com/html/html-introduction-course-learn-html-in-2-hours
Electronics: AC  & DC Analysis of DiodeS, http://programming.discudemy.com/hardware/electronics-ac-dc-analysis-of-diodes
cPanel For WordPress: How To Use cPanel [Beginners] , http://programming.discudemy.com/wordpress/how-to-use-cpanel-tutorial-wordpress
Crea una página web MODERNA con HTML CSS y JS, http://programming.discudemy.com/ios/crea-tu-primera-pagina-web
How to Create a Website using WordPress (Step by Step), http://programming.discudemy.com/wordpress/how-to-create-a-website-using-wordpress-2019
تصميم الخرائط الاحترافية, http://programming.discudemy.com/programming-other/mapsdesign
Parallel execution in Test Automation Selenium WebDriverIOv5, http://programming.discudemy.com/debug-test/parallel-execution-test-automation-webdriveriov5
Master the Basics of HTML5 & CSS3: Beginner Web Development, http://programming.discudemy.com/html/master-the-basics-of-html5-css3-beginner-web-development
تمرين عملي شامل|صمم شاشة تطبيق موبايل احترافية في 9 فيديوهات, http://programming.discudemy.com/android/9-udncrg
Understanding Docker and using it for Selenium automation, http://programming.discudemy.com/development-tools/understanding-docker-performing-selenium-automation
Fundamentos de programación en Java, http://programming.discudemy.com/java/fundamentos-de-programacion-en-java-ricrack
ExpressJS Fundamentals, http://programming.discudemy.com/javascript/expressjs-fundamentals
Impara le basi di JavaScript, http://programming.discudemy.com/javascript/impara-le-basi-di-javascript
One hour Kotlin guide for beginners, http://programming.discudemy.com/android/one-hour-kotlin-guide-for-beginners
Learn JavaFX tutorials from Beginners Level, http://programming.discudemy.com/java/learn-javafx-tutorials-from-beginners-level
Técnicas e Conceitos para Aumentar as Visitas do seu Website, http://programming.discudemy.com/seo/duckyo-introducao-ao-seo
</ZERO> Coding Algorithmic Trading with TSLab: Basics, http://programming.discudemy.com/robotics/zero-coding-algorithmic-trading-with-tslab
Laravel 6 PHP Framework for Just Beginners, http://programming.discudemy.com/php/laravel-6-framework
Eclipse tips and tricks, http://programming.discudemy.com/development-tools/eclipse-tips-and-tricks
2 Arduino robots in 1 course : The boat and the fisherman !, http://programming.discudemy.com/robotics/build-a-bluetooth-controlled-water-robot-in-simple-steps
Mocking application with Moq, http://programming.discudemy.com/development-tools/moq-framework
Complete Python Masterclass - Learn From Scratch, http://programming.discudemy.com/python/complete-python-masterclass-learn-from-scratch
Crie Jogos em Construct 2: Roguelike de Plataforma, http://programming.discudemy.com/development-tools/roguelike-plataforma-construct-2
Complete Java Course - Learn From Scratch, http://programming.discudemy.com/java/complete-java-course-learn-from-scratch-d
Algoritimo 101:  Somente Algumas Aulas, http://programming.discudemy.com/programming-other/algoritimo-101-somente-algumas-aulas
Personal Computer/Gaming Rig Fundamentals, http://programming.discudemy.com/game-development/personal-computergaming-rig-fundamentals
Build a Squarespace website step by step (template included), http://programming.discudemy.com/e-commerce/build-a-squarespace-website-step-by-step
Data Integration with the MarkLogic NoSQL Database, http://programming.discudemy.com/nosql/data-integration-with-the-marklogic-nosql-database
Visual Basic Para Oficinas, http://programming.discudemy.com/programming-other/visual-basic-para-oficinas
Capybara: Automatize testes para aplicações Web com Ruby, http://programming.discudemy.com/ruby/capybara
Complete Python Course: Go From Beginner To Expert, http://programming.discudemy.com/python/complete-python-course-go-from-beginner-to-expert
Ultimate JavaScript Strings, http://programming.discudemy.com/javascript/js-strings
Introduction to programming with Python | Live support, http://programming.discudemy.com/python/introduction-to-programming-with-python-beginners-course
Build Powerful Private Blog Networks for Top SEO Rankings, http://programming.discudemy.com/seo/private-blog-network-course
Enquête Avec Sphinx : Créer Votre Questionnaire, http://programming.discudemy.com/development-tools/enquete-avec-sphinx-creer-un-questionnaire
Introducing Spring Boot, http://programming.discudemy.com/java/spring-boot-getting-started
How To Start Shopify Dropshipping eCommerce Business, http://programming.discudemy.com/e-commerce/how-to-start-shopify-dropshipping-ecommerce-business
Office 365 - Basics of Microsoft's Cloud Service , http://programming.discudemy.com/development-tools/office-365-basics-of-microsofts-cloud-service
php function with MySQL (Insert- Update and Delete), http://programming.discudemy.com/php/php-function-with-mysql-insert-update-and-delete
KeePass - Zadbaj o bezpieczeństwo w sieci, http://programming.discudemy.com/javascript/keepass-zadbaj-o-bezpieczenstwo-w-sieci
