Learn Xaml Controls For Windows & Windows Phone 8.1, http://programming.discudemy.com/development-tools/xaml-controls-for-windows-windows-phone-81-in-arabic
Let's JavaScript!  Newbie Friendly: Part 1, http://programming.discudemy.com/javascript/lets-javascript-beginners-coding-projects
Web/Front End/UI Development Beginner - Learn HTML and CSS, http://programming.discudemy.com/html/learn-html-css-beginner
Shopify Meisterkurs (Light): Der kurze Shopify Meisterkurs, http://programming.discudemy.com/e-commerce/shopify-meisterkurs-light-der-kurze-shopify-meisterkurs
How to Make a WordPress Website in 2017, http://programming.discudemy.com/wordpress/how-to-make-a-wordpress-website-in-2017
Integração de Soluções com Web Services, http://programming.discudemy.com/web-development-other/introducao-web-services
Learn Devops Kubernetes deployment by kops and terraform, http://programming.discudemy.com/development-tools/learn-devops-kubernetes-deployment-by-kops-and-terraform
Business Intelligence de gestión comercial Con Tableau, http://programming.discudemy.com/development-tools/business-intelligence-con-tableau
Componente canvas, http://programming.discudemy.com/development-tools/componente-canvas
WordPress Webseiten erstellen 2018, http://programming.discudemy.com/wordpress/wordpress-webseiten-erstellen
Just Enough Istio to be Dangerous, http://programming.discudemy.com/development-tools/just-enough-istio-to-be-dangerous
App Inventor 2: Componente Contact Picker, http://programming.discudemy.com/development-tools/app-inventor-2-componente-contact-picker
How To Create A Website using WordPress (Step by Step), http://programming.discudemy.com/wordpress/how-to-create-a-website-using-wordpress-step-by-step
Try Django 2.2 - Web Development with Python 3.6+, http://programming.discudemy.com/django/try-django-2-2-python-web-development
PHP7入门手册视频版第一季, http://programming.discudemy.com/php/php7php7
Publish Websites with WebHostingSquared, http://programming.discudemy.com/development-tools/webhosting-101
How to Make a Wordpress Website - Step by Step!!, http://programming.discudemy.com/wordpress/how-to-make-a-wordpress-website-step-by-step-full-course
Oracle RAC and Grid Infrastructure Concepts, http://programming.discudemy.com/sql/oracle-rac-and-grid-infrastructure-concepts
Visual Paradigm Essential, http://programming.discudemy.com/development-tools/visual-paradigm-essential
Shopware Template Training - Advanced, http://programming.discudemy.com/web-development-other/shopware-template-training-advanced
AppInvento2 ImagePicker, http://programming.discudemy.com/development-tools/appinvento2-imagepicker
SEO : The 5 Laws, http://programming.discudemy.com/seo/the-5-laws-of-seo
How to Build a Professional Website on your Own in 2 hours, http://programming.discudemy.com/wordpress/how-to-build-a-professional-website-on-your-own-in-2-hours
Everything for Software Tester, http://programming.discudemy.com/debug-test/everything-for-software-tester
Intro to Programming, http://programming.discudemy.com/programming-other/intro-to-programming-ricky-wahowa
Crie Visual Novel e Text-based Games com Twine (open-source), http://programming.discudemy.com/game-development/crie-visual-novel-e-text-based-games-com-twine-open-source
CSS3 Grundlagen, http://programming.discudemy.com/css/css3-grundlagen
MAGENTO 2 scratch 2019 The First Step to Open Your ecommerce, http://programming.discudemy.com/e-commerce/magento-scratch-ecommerce-open-first-shop-online
Basic Yii Framework สำหรับผู้เริ่มต้น, http://programming.discudemy.com/php/basic-yii-framework
Conhecendo OBIEE - Recursos Adicionais de uma Análise, http://programming.discudemy.com/sql/conhecendo-obiee-recursos-adicionais-de-uma-analise
Ionic 3 กับ Google Map ดึงข้อมูลผ่าน PHP + mysql, http://programming.discudemy.com/php/ionic-3-google-map-php-mysql
SEO (Search Engine Optimization) From Zero To Hero! - FREE, http://programming.discudemy.com/seo/seo-beginners
Learn To Create A Website In 1 Hour. No Tech Skills Required, http://programming.discudemy.com/web-development-other/learn-to-create-a-website-in-1-hour-
Introduction to Xamarin.Android, http://programming.discudemy.com/android/introduction-to-xamarinandroid
プラットフォームの横暴への対処方法と栄枯盛衰の要因 - (Adtech Tokyo 2012 B-6), http://programming.discudemy.com/development-tools/elearners-adtechtokyo2012trackb6
Site web ECommerce avec WordPress et Facebook business, http://programming.discudemy.com/wordpress/site-web-ecommerce-avec-wordpress-et-facebook-business
Make a Professional Looking Business Website, http://programming.discudemy.com/wordpress/create-a-parallax-business-website
Jupyter Notebook入門 - Pythonで計算、グラフ、画像表示、CSV読み込みからスクレイピングまで, http://programming.discudemy.com/python/paizacloud-jupyter-notebook
Iniciando con Containers en Docker, http://programming.discudemy.com/development-tools/iniciando-con-containers-en-docker
How To Build a Stunning Website with WordPress in 70 Minutes, http://programming.discudemy.com/wordpress/how-to-build-a-website-with-wordpress
PHP tutorial for beginners, http://programming.discudemy.com/php/php-tutorial-for-beginners-j
Lógica Programación: Aprende Programar en Cualquier Lenguaje, http://programming.discudemy.com/programming-other/logica-programacion-aprende-programar-en-cualquier-lenguaje
HOT & NEW :Learn Construct 2 From Scratch and build games, http://programming.discudemy.com/game-development/learn-construct-2-from-scratch-and-build-games
Crie Jogos em Construct 2: Beat'em up / Brawler, http://programming.discudemy.com/development-tools/beatem-up-construct-2
Git and GitHub - Step by Step for Beginners, http://programming.discudemy.com/git/git-and-github-step-by-step-for-beginners
WooCommerce One Click Upsells: The Step-by-Step Masterclass, http://programming.discudemy.com/wordpress/woocommerce-one-click-upsells
Web Hosting - Create And Host Your Website Online!, http://programming.discudemy.com/development-tools/web-hosting-india-host-your-website-online
WordPress E-Commerce with WooCommerce in Urdu / Hindi, http://programming.discudemy.com/wordpress/wordpress-e-commerce-with-woocommerce-in-urdu-hindi
Como Criar Blogs Grátis em Menos de 1 Hora, http://programming.discudemy.com/e-commerce/como-criar-blogs-gratis
Java Grundlagen - Einsteigerkurs für Programmier Neulinge, http://programming.discudemy.com/java/java-grundlagen-einsteiger-kurs
Python & Cryptocurrency: Build 5 Real World Applications, http://programming.discudemy.com/python/coinmarketcap
Learn Data Science With R Part 1 of 10, http://programming.discudemy.com/programming-other/datascience_with_r
BIM for Infrastructure Megaprojects, http://programming.discudemy.com/development-tools/bim-for-infrastructure-megaprojects
Altium Circuit Maker Beginner Course, http://programming.discudemy.com/hardware/altium-circuit-maker
Information System Analysis and Design (Indonesian Version), http://programming.discudemy.com/development-tools/information-system-analysis-and-design
Elementor - Como Criar Sites Personalizados no WordPress, http://programming.discudemy.com/wordpress/elementor-como-criar-sites-personalizados-no-wordpress
String- StringBuffer & StringBuilder for JAVA Certification, http://programming.discudemy.com/java/string-stringbuffer-stringbuilder-for-java-certification
Build 6 iOS Games with Swift and Xcode, http://programming.discudemy.com/ios/build-6-ios-games-with-swift-and-xcode
Create a Wordpress Website - The Ultimate Complete Guide, http://programming.discudemy.com/wordpress/dmwithkarlwebsite
HTML Intensivo 2019: Iniciate en el Front-End con aLyrae, http://programming.discudemy.com/html/html-intensivo-2019-iniciate-en-el-front-end-con-alyrae
The Essential Android O Developer Course (Java), http://programming.discudemy.com/android/the-essential-android-o-developer-course-java
Learn the basics of HTML in a hour!, http://programming.discudemy.com/html/html-in-1-hour
C Programming Language STEP by STEP - Part 1, http://programming.discudemy.com/c/c-language-foundations-demystified
SQL - Cours Complet - Apprendre SQL de A à Z, http://programming.discudemy.com/sql/sql-cours-complet-apprendre-sql-de-a-a-z
Database Design and Management, http://programming.discudemy.com/sql/database-design-and-management
Python from Beginner to Intermediate in 30 min., http://programming.discudemy.com/python/python-from-beginner-to-expert-starter-free
Introdução aos conceitos de Python, http://programming.discudemy.com/python/introducao-aos-conceitos-de-python
ASP.NET Core MVC- Quick and Practical, http://programming.discudemy.com/csharp/aspnet-core-mvc-quick-and-practical
MacOSで行う開発効率UP講座, http://programming.discudemy.com/development-tools/deveff_up
Complete Advanced Uipath Bootcamp - Explore the Technology, http://programming.discudemy.com/programming-other/complete-advanced-uipath-bootcamp-explore-the-technology
Shopify Dropshipping And Private Label Products The Easy Way, http://programming.discudemy.com/e-commerce/shopify-dropshipping-and-private-label-products-the-easy-way
Estructuras de datos en R [nivel básico] en Español, http://programming.discudemy.com/programming-other/estructuras-de-datos-en-r-nivel-basico-en-espanol
Learn How to Create and ECOMMERCE Website with Wordpress, http://programming.discudemy.com/wordpress/learn-how-to-create-and-ecommerce-website-with-wordpress
Wordpress Beginner Tutorial: Build Your First Website, http://programming.discudemy.com/wordpress/wordpress-beginner-tutorial-build-your-first-website
SQL Server Baby Step: Installation and Configuration, http://programming.discudemy.com/sql/sql-server-baby-step
Net DevOps: Cisco  Python- Automation- NETCONF- SDN- Docker, http://programming.discudemy.com/development-tools/net-devops-cisco-python-automation-netconf-sdn-docker
Foundations of Agile Software Testing, http://programming.discudemy.com/debug-test/foundations-of-agile-software-testing-j
Learn how to code with python, http://programming.discudemy.com/python/learn-how-to-code-with-python
Bootstrap 4 from Scratch With Projects, http://programming.discudemy.com/bootstrap/bootstrap-responsive-design-tutorial
Create Business Applications with AppSheet, http://programming.discudemy.com/web-development-other/create-business-applications-with-appsheet
Programing from 39 mins - 3 hours max, http://programming.discudemy.com/python/less-than-3-hours
SAP Debugging for Functional Consultants, http://programming.discudemy.com/development-tools/sap-abap-debugging-for-functional-consultants
Portfolio Website with Node JS & Express, http://programming.discudemy.com/nodejs/portfolio-website-with-node-js-express
第七季 ThinkPHP5商城及功能整合, http://programming.discudemy.com/php/thinkphp5-rx
Sıfırdan Firma Scripti Kodluyoruz, http://programming.discudemy.com/php/sifirdan-firma-scripti-kodluyoruz
Introduction to Bootstrap 3, http://programming.discudemy.com/bootstrap/introduction-to-bootstrap-3
Learn On-Page SEO Methods of the Pros, http://programming.discudemy.com/seo/learn-on-page-seo-methods-of-the-pros
Introdução ao PHP orientado a objetos, http://programming.discudemy.com/php/php-orientado-a-objetos
Learn Search Engine Optimization from scratch, http://programming.discudemy.com/seo/learn-search-engine-optimization-from-scratch
Use Wordpress and Ultimatum - Create Working ECommerce Sites, http://programming.discudemy.com/wordpress/build-an-ecommerce-store-in-less-than-1-hour-with-wordpress
Python入門|微信機器人|比特幣自動交易|交易所API實時通信|AWS cloud9開發環境, http://programming.discudemy.com/python/python-ccb
Juegos Móviles con HTML5 - Veggies vs Zombies, http://programming.discudemy.com/html/juegos-html5
Python 3 na Prática, http://programming.discudemy.com/python/python-3-na-pratica
Dash algajatele, http://programming.discudemy.com/robotics/dash-algajatele
WordPress desde cero (nivel básico), http://programming.discudemy.com/wordpress/wordpress-desde-cero-nivel-basico
Learn Angular 5 from Scratch, http://programming.discudemy.com/angular/angular-5
Getting Started With Wordpress - A Beginners Guide, http://programming.discudemy.com/wordpress/getting-started-with-wordpress-a-beginners-guide
Curso de Performance Web, http://programming.discudemy.com/development-tools/curso-de-performance-web
WordPress para Iniciantes, http://programming.discudemy.com/wordpress/wordpress-para-iniciantes
Complete WooCommerce Plugin Tutorial For Wordpress 2017, http://programming.discudemy.com/wordpress/complete-woocommerce-plugin-tutorial-for-wordpress-2017
Python 3 na Web com Django (Básico e Intermediário), http://programming.discudemy.com/python/python-3-na-web-com-django-basico-intermediario
처음 시작하는 C Programming, http://programming.discudemy.com/c/softcampus-cp
Advanced E-commerce Simplified, http://programming.discudemy.com/e-commerce/advanced-e-commerce-simplified
Get Started with Programming in C: Full Course, http://programming.discudemy.com/programming-other/get-started-with-programming-in-c-full-course
Curso Wordpress Iniciante, http://programming.discudemy.com/wordpress/curso-wordpress-iniciante-gratuito
SEO Introduction from an ex-Googler, http://programming.discudemy.com/seo/seo-introduction-from-an-ex-googler
Mi primer juego con Unity 5, http://programming.discudemy.com/game-development/mi-primer-juego-con-unity-5
Unreal Engine 4 criando game Desafios /Aventura, http://programming.discudemy.com/ios/unreal-engine-4-criando-game-desafios-aventura
Shopware User Training English, http://programming.discudemy.com/e-commerce/shopware-user-training-english
Основы HTML и CSS с нуля, http://programming.discudemy.com/html/html-css-from-zero
Bootstrap ile Web Site Yapımı, http://programming.discudemy.com/bootstrap/bootstrap-ile-web-site-yapm
Learn Visio Quickly!, http://programming.discudemy.com/development-tools/learn-visio-quickly
Agile 101-A simple introduction to Agile origin & principles, http://programming.discudemy.com/development-tools/agile-101-a-simple-introduction-to-agile-origin-principles
Career & Jobs in Big Data Science Zero 2 Hero A-Z New York, http://programming.discudemy.com/nosql/career-jobs-in-big-data-science-zero-2-hero-a-z-new-york
Probability in R. Discrete Random Variables, http://programming.discudemy.com/programming-other/probability-in-r-discrete-random-variables
Como Instalar o WordPress em Localhost, http://programming.discudemy.com/wordpress/como-instalar-o-wordpress-em-localhost
Curso Asp.Net MVC + Entity Framework para principiantes, http://programming.discudemy.com/csharp/curso-aspnet-mvc-entity-framework-para-principiantes
The Complete Guide to iOS 7 - iPhone Edition, http://programming.discudemy.com/ios/the-complete-guide-to-ios-7-iphone-edition
Java From Scratch, http://programming.discudemy.com/java/java-from-scratch
App Localization in Android - Reach more users globally, http://programming.discudemy.com/android/app-localization-android-multi-language-support
Free Website Builder /  Application Builder, http://programming.discudemy.com/html/build-website
Fundamentals Of PLC Programming Using Logixpro Simulator, http://programming.discudemy.com/hardware/ladder-programming-using-logixpro-for-electrical-engineering
Android Processes- Threads Slidenerd Style, http://programming.discudemy.com/android/master-android-zero-to-hero
MongoDB from scratch in Urdu/Hindi language, http://programming.discudemy.com/nosql/mongodb-from-scratch-in-urduhindi-language
Learn Construct 2: Creating a Pixel Platformer in HTML5!, http://programming.discudemy.com/game-development/learn-construct-2-creating-a-pixel-platformer-in-html5
Complete Python Course: Learn Hands On Practically, http://programming.discudemy.com/python/complete-python-course-learn-hands-on-practically-i
Python NumPy For Your Grandma, http://programming.discudemy.com/python/python-numpy-for-your-grandma
Learn C# Basic, http://programming.discudemy.com/development-tools/learn-c-basic
HTML5 Mobile Game Development by Example -Veggies vs Zombies, http://programming.discudemy.com/android/html5-mobile-game-tutorial
Xamarin Forms for Android and iOS Native Development, http://programming.discudemy.com/ios/xamarin-forms-free
【最短30分でできる!】Django2.1入門: 初心者でも簡単! ブラウザだけでDjangoを使ったWeb開発！, http://programming.discudemy.com/django/paizacloud-django
API (REST/SOAP) Testing using JMeter with Real Examples, http://programming.discudemy.com/development-tools/api-rest-soap-testing-using-jmeter-with-real-examples
Complete Java Course: Beginner to Advanced, http://programming.discudemy.com/java/complete-java-course-beginner-to-advanced-b
Python for Beginner, http://programming.discudemy.com/python/python-hackcc
Termómetro digital con Raspberry Pi, http://programming.discudemy.com/robotics/termometro-digital-con-raspberry-pi
Curso de MYSQL, http://programming.discudemy.com/sql/curso-de-mysql
Java Basiskurs zur Grundlagenbildung, http://programming.discudemy.com/java/java-basiskurs-zur-grundlagenbildung
Build a Quiz App with HTML- CSS- and JavaScript, http://programming.discudemy.com/html/build-a-quiz-app-with-html-css-and-javascript
Chrome Extensions for Web Developer, http://programming.discudemy.com/development-tools/chrome-extensions-for-web-developer
PHP framework programming, http://programming.discudemy.com/php/php-framework-programming-php
Practical Game Development in Unity 4: Level 1, http://programming.discudemy.com/game-development/practical-game-development-in-unity-4-level-1
Axxon Next, http://programming.discudemy.com/development-tools/axxon_next
How to Make WordPress Membership Website, http://programming.discudemy.com/wordpress/how-to-make-wordpress-membership-website-and-make-money
Aprende HTML5 y CSS3 desde cero, http://programming.discudemy.com/html/aprende-html5-y-css3-desde-cero
Learn Python from Scratch, http://programming.discudemy.com/python/learn-python-from-scratch-m
Online Marketing For Your Local Business Made Simple, http://programming.discudemy.com/seo/local-marketing-using-the-internet-and-social-media
Learn to Build Mobile Games using Corona SDK, http://programming.discudemy.com/game-development/learn-to-build-mobile-games-using-corona-sdk
How to Make a PROFESSIONAL Website for Beginners (2019), http://programming.discudemy.com/wordpress/how-to-make-a-professional-website
Introduction to programming with Visual Basic.Net 2013, http://programming.discudemy.com/programming-other/introtovb
Filemaker Beginner Tutorial - contacts database, http://programming.discudemy.com/sql/filemaker-beginner-tutorial-contacts-database
SHOPWARE Online Shop erstellen ohne programmierkenntnisse, http://programming.discudemy.com/development-tools/shopware-kurs-ohne-programmieren-online-shop-erstellen
Learn HTML & CSS From Scratch! The Beginners Guide, http://programming.discudemy.com/html/learn-html-css-from-scratch-the-beginners-guide
Lógica da programação com  Unity, http://programming.discudemy.com/game-development/logica-da-programacao-em-unity
CYPELEC HE5 Instalaciones fotovoltaicas, http://programming.discudemy.com/robotics/cypeleche5
IC Design Process: A Beginner's Overview to VLSI Technology, http://programming.discudemy.com/robotics/svac_c1_ic_design_manufacturing_process
Launch A Squarespace Website For Beginners, http://programming.discudemy.com/e-commerce/launch-a-squarespace-website-in-less-than-2-hours
Advanced Statistical Analytics (SAS Programming), http://programming.discudemy.com/programming-other/advanced-sas-programming
Aprenda Delphi e Lazarus do Zero - 100% Gratuito, http://programming.discudemy.com/programming-other/aprenda-delphi-e-lazarus-do-zero
Eclipse Tutorial For Beginners : Learn Java IDE in 10 Steps, http://programming.discudemy.com/java/eclipse-java-tutorial-for-beginners
iPhone 101 (iOS 7 Version), http://programming.discudemy.com/ios/iphone-101-ios-7-version
Learn Microsoft T-SQL The Easy Way, http://programming.discudemy.com/sql/learn-microsoft-t-sql-the-easy-way
WordPress Components - any platform- any device., http://programming.discudemy.com/wordpress/powerful-html-pages-using-wordpress-component-architecture
Java SE - F1, http://programming.discudemy.com/java/java-se-f1
Seria Web Developer Prolog, http://programming.discudemy.com/web-development-other/seria-web-developer-prolog
Crea Una Página Web Desde Cero Edición Divi, http://programming.discudemy.com/html/crea-una-pagina-web-desde-cero-edicion-divi
Reskin And Publish Amazon App On Amazon App Store, http://programming.discudemy.com/programming-other/reskin-and-publish-amazon-app-on-amazon-app-store
Python Programlamanın Temelleri, http://programming.discudemy.com/python/python-programlamann-temelleri
Natural Language Processing (NLP) for Beginners Using NLTK, http://programming.discudemy.com/programming-other/natural-language-processing-nlp-for-beginners-using-nltk-in-python
Python Programming Basic, http://programming.discudemy.com/python/python-programming-basic
Getting Started with Elasticsearch, http://programming.discudemy.com/sql/elasticsearch101
Introdução à Criação de Sites Dinâmicos com PHP, http://programming.discudemy.com/php/criacao-de-paginas-de-internet-dinamicas-com-php-basico
ASP.NET: Create News Website, http://programming.discudemy.com/programming-other/aspnet-create-news-website
Swift 5 и Приложения под iOS и macOS: От новичка до профи, http://programming.discudemy.com/ios/swift-42-ios-macos
Flexapp ile Android ve IOS uygulama geliştirme, http://programming.discudemy.com/mobile-development-other/flexapp-ile-kod-yazmadan-android-ve-ios-uygulama-gelistirme
SDLC models:basics for beginners, http://programming.discudemy.com/development-tools/sdlc-models
CYPE IFCBuilder, http://programming.discudemy.com/development-tools/cype-ifcbuilder
Boas práticas em PHP, http://programming.discudemy.com/php/boas-praticas-em-php
Getting Started With Buildbox 2, http://programming.discudemy.com/game-development/getting-started-with-buildbox-2
Unity 3D ile Sıfırdan Oyun Geliştirmeyi Öğrenin, http://programming.discudemy.com/csharp/unity-egitim-seti
Aprende HTML5 para hacer tus propios diseños web, http://programming.discudemy.com/html/aprende-html5-para-hacer-tus-propios-disenos-web
Learn HTML in 2 hours!, http://programming.discudemy.com/html/learn-html5-in-2-hours
WordPress Website in a Weekend, http://programming.discudemy.com/wordpress/how-to-build-a-wordpress-website-in-a-weekend
The Complete WordPress for Beginner! Swiftly Profit by HU, http://programming.discudemy.com/wordpress/the-complete-wordpress-for-beginner-swiftly-profit-by-hu
A Rookie's Guide to Raspberry Pi, http://programming.discudemy.com/robotics/a-rookies-guide-to-raspberry-pi
How To Make A Beautiful WordPress Website & FREE Domain!, http://programming.discudemy.com/wordpress/how-to-make-a-beautiful-wordpress-website-today
Tienda Online Con WooCommerce Desde Cero, http://programming.discudemy.com/wordpress/tienda-online-con-woocommerce-desde-cero
JMeter - Step by Step for Beginners, http://programming.discudemy.com/programming-other/jmeter-step-by-step-for-beginners
How to Make an Online Portfolio Website from Scratch , http://programming.discudemy.com/wordpress/how-to-make-a-portfolio-website-photographers-designers
تصميم البنرات الاعلانية للمواقع باستخدام Adobe Animate CC, http://programming.discudemy.com/html/adobe-animate-html5-ar
App Inventor ListView, http://programming.discudemy.com/development-tools/app-inventor-listview
Consultas con SQL Server 2016, http://programming.discudemy.com/sql/aprende-consultas-con-sql-server
HTML5 para quem não sabe nada de HTML5, http://programming.discudemy.com/html/aprendahtml
La biblia perdida de Bootstrap 4, http://programming.discudemy.com/bootstrap/curso-la-biblia-perdida-de-bootstrap-4
Devtools Pro: The Basics of Chrome Developer Tools, http://programming.discudemy.com/development-tools/devtools-2017-the-basics-of-chrome-developer-tools
Pyhton ve Algoritma, http://programming.discudemy.com/programming-other/pyhton-ve-algoritma
Learn C++ Programming From Scratch, http://programming.discudemy.com/cpp/learn-c-plus-plus-programming-from-scratch
Introduction to the Raspberry Pi, http://programming.discudemy.com/robotics/introduction-to-the-raspberry-pi
Configurar Laravel en Windows y MS SQL Server, http://programming.discudemy.com/php/laravel-y-sql-server
Test Data Generation for Selenium and Appium, http://programming.discudemy.com/debug-test/test-data-generation-for-selenium-and-appium
Introducción teórica a los frameworks de desarrollo para PHP, http://programming.discudemy.com/php/introduccion-teorica-a-los-framework-de-desarrollo-para-php
In-App Purchasing with iOS 7- Consumable and Non-Consumables, http://programming.discudemy.com/ios/inappbuying
Learn Qt and QML by Creating Cross Platform Apps with Felgo, http://programming.discudemy.com/android/learn-qt-qml-v-play-and-keoba
Learn CSS, http://programming.discudemy.com/html/learn-and-understand-complete-html-and-css
Java ile Android P Mobil Uygulama Meditasyon Uygulaması, http://programming.discudemy.com/android/java-ile-android-p-mobil-uygulama-meditasyon-uygulamasi
Web Developer Course on Creating a Business Website, http://programming.discudemy.com/java/web-developer-course-on-creating-a-business-website
Complete Python Course: Go From Beginner To Advanced, http://programming.discudemy.com/python/complete-python-course-go-from-beginner-to-advanced-x
Complete TypeScript For Beginners, http://programming.discudemy.com/nodejs/typescript-fundamentals
Stwórz Responsywny Projekt w HTML i CSS w 2 Godziny, http://programming.discudemy.com/html/projekt-html-css
