Coding for Entrepreneurs Basic, http://programming.discudemy.com/django/coding-for-entrepreneurs-basic
Asp.Net MVC, http://programming.discudemy.com/csharp/aspnet-mvc-praktyczny-kurs
Ultimate WordPress Package Volume 4, http://programming.discudemy.com/wordpress/ultimate-wordpress-package-volume-4
Crea sitios web con Drupal, http://programming.discudemy.com/e-commerce/curso-basico-de-drupal
Develop Your Own Game Quick & Easy with Game Maker Studio, http://programming.discudemy.com/game-development/develop-your-own-game-in-3-hours-with-game-maker-studio
TypeScript Fast Crash Course, http://programming.discudemy.com/javascript/typescript-fast-crash-course
Web Development Course : laravel 5.5 ORM  and Raw PHP!, http://programming.discudemy.com/php/web-development-with-php-build-a-nice-job-recruitment-site
Жизнь после "восьмерки": новый функционал в JDK9 и далее, http://programming.discudemy.com/java/jdk9-and-beyond
Flask速習講座_Part1, http://programming.discudemy.com/python/flask_part1
Masterclass: Efectos del uso de funciones en el CBO Oracle, http://programming.discudemy.com/sql/masterclass-oracle-optimizacion-sql-uso-funciones-cbo
たった60分でプロ並みのホームページができるWordPress作成初級講座, http://programming.discudemy.com/wordpress/wordpress-beginner
Scratch ile Çocuklar için Kodlama, http://programming.discudemy.com/programming-other/scratch-ile-cocuklar-icin-kodlama
Ruby Para Iniciantes, http://programming.discudemy.com/ruby/ruby-para-iniciantes
Initiation au web : HTML- CSS, http://programming.discudemy.com/html/initiation-au-web-html-css
Batting Location Charts with Vagrant and MySQL, http://programming.discudemy.com/sql/baseball4
Master Data Analysis with Python - Intro to Pandas, http://programming.discudemy.com/python/master-data-analysis-with-python-intro-to-pandas
Learn C++ Game Development, http://programming.discudemy.com/cpp/learn-c-game-development
Complete Microsoft Excel Course: Beginner to Advance, http://programming.discudemy.com/python/complete-microsoft-excel-course-beginner-to-advance
Command Line Essentials: Git Bash for Windows, http://programming.discudemy.com/git/git-bash
Basics of Object Oriented Programming with C#, http://programming.discudemy.com/csharp/basics-of-object-oriented-programming-with-csharp
DevOps Essentials, http://programming.discudemy.com/development-tools/linux-academy-devops-essentials
Understanding Bitshift Operations, http://programming.discudemy.com/game-development/bitshift-operations
Aprende App Inventor, http://programming.discudemy.com/development-tools/aprende-app-inventor
Design and Prototype an iOS8 Mobile App on Illustrator, http://programming.discudemy.com/ios/mobileprototype
App Inventor 2 NxtLightSensor, http://programming.discudemy.com/development-tools/app-inventor-2-nxtlightsensor
Angular 2, http://programming.discudemy.com/angular/angular-2-szybki-start
SAP SD Interview Questions, http://programming.discudemy.com/programming-other/sap-sd-interview-questions
Intro to SceneKit. An easy to use iOS 3D framework., http://programming.discudemy.com/ios/scenekit
The Ultimate Python Course: Go From Zero To Hero, http://programming.discudemy.com/python/the-ultimate-python-course-go-from-zero-to-hero
【Scrapy基础】租房信息爬虫, http://programming.discudemy.com/python/bulabean-scrapy
Construct 2 - Your first game., http://programming.discudemy.com/game-development/construct-2-your-first-game
Learn Brackets - The Open Source Text Editor, http://programming.discudemy.com/development-tools/brackets
Free Python 101 Class Beginners Bootcamp Intro to Python NYC, http://programming.discudemy.com/python/python-101-beginners-coding-bootcamp-free-course
Основы C# с нуля, http://programming.discudemy.com/csharp/csharp-base
VS Code: Produtividade Infinita Dev. Mobile + [EBOOK FREE], http://programming.discudemy.com/development-tools/vscode-mobile
Cria jogos com Construct 2 - Iniciante, http://programming.discudemy.com/game-development/cria-jogos-com-construct-2-basico
Learn Jira Complete from Scratch to Expert, http://programming.discudemy.com/development-tools/learn-jira-complete-from-scratch-to-expert
Fundamentos de Angular, http://programming.discudemy.com/angular/fundamentos-de-angular
PHP - Advanced Features, http://programming.discudemy.com/php/php-advanced-features
Beginner Python3 Tutorials, http://programming.discudemy.com/python/beginner-python3-tutorials
Curso React.js Ninja: Módulo React + Webpack, http://programming.discudemy.com/javascript/reactjs-ninja-modulo-react-webpack
[Unreal 4]빛반사 퍼즐 만들기 튜토리얼, http://programming.discudemy.com/game-development/unreal-4
Android for Beginners, http://programming.discudemy.com/android/s2k-android-beginners
Develop Mobile Data Collection Solutions using Kobo Toolbox, http://programming.discudemy.com/development-tools/develop-mobile-data-collection-solutions-using-kobo-toolbox
npm - Mastering the Basics, http://programming.discudemy.com/development-tools/npm-mastering-the-basics
Learn Spring Boot the Easy Way!, http://programming.discudemy.com/java/spring-boot-tutorial-beginners
Create a WordPress Blog under 1.5 Hours (in 2019), http://programming.discudemy.com/wordpress/how-to-create-a-wordpress-blog
Introduction to Text To Speech With Python, http://programming.discudemy.com/python/introduction-to-text-to-speech-with-python
Hiç Bilmeyenler için Python, http://programming.discudemy.com/python/hic-bilmeyenler-icin-python
ZK Web And Mobile Apps From Scratch Using Java, http://programming.discudemy.com/javascript/zk-webmobile-apps
Beginner Photoshop to HTML5 and CSS3, http://programming.discudemy.com/html/psd-html5-css3
JENKINS Beginner Tutorial - Step by Step, http://programming.discudemy.com/development-tools/jenkins-beginner-tutorial-step-by-step
Master the WordPress Gutenberg Editor, http://programming.discudemy.com/wordpress/master-the-gutenberg-editor-in-1-hour
Intermediate Level C++, http://programming.discudemy.com/cpp/intermediate-level-c
HTML For Absolute Beginners, http://programming.discudemy.com/html/beginners-html
Aprende Laravel - Modelos- Migraciones- Rutas- Vistas- etc, http://programming.discudemy.com/php/aprende-laravel-modelos-migraciones-rutas-vistas-etc
Laravel 5.4 complete tutorial for Beginners and Intermediate, http://programming.discudemy.com/php/laravel-complete-tutorial-for-beginners-and-intermediate
Visual Studio Code: Mejora tu velocidad para codificar, http://programming.discudemy.com/development-tools/vscode-mejora-tu-velocidad-para-codificar
Faça um pequeno game casual em construct 2, http://programming.discudemy.com/game-development/faca-um-pequeno-game-casual-em-construct-2
How To Make A Wordpress Website 2019 - No Experience Needed!, http://programming.discudemy.com/wordpress/wordpress-thrive-architect-tutorial
Learn HTML by Creating Web Pages in 85 Minutes for Beginners, http://programming.discudemy.com/html/practical-html
Herkes için Scratch Eğitimi ve Uygulamaları, http://programming.discudemy.com/programming-other/herkes-icin-scratch-egitimi-ve-uygulamalari
Material for Angular 6 - UI UX Ivy League Instructor, http://programming.discudemy.com/angular/materialangular
React basic in just 1 hour, http://programming.discudemy.com/javascript/react-basic-in-just-1-hour
Laravel Türkçe Eğitim Seti, http://programming.discudemy.com/php/laravel-turkce-egitim-seti
Learn BigData & Hadoop with Practical, http://programming.discudemy.com/nosql/learn-bigdata-hadoop-with-practical
This Is How You Make iPhone Apps - iOS Development Course, http://programming.discudemy.com/ios/iosdevelopment
Crea tu blog con WordPress, http://programming.discudemy.com/wordpress/crea-tu-blog-con-wordpress
WordPress Tutorial for Beginners 2019 - EASY and FAST!, http://programming.discudemy.com/wordpress/wordpress-website-tutorial
Introducción a Angular 4 - Instalación y componentes, http://programming.discudemy.com/angular/introduccion-a-angular-4
Algoritma ve Programlama Mantığı Eğitimi, http://programming.discudemy.com/programming-other/algoritma-ve-programlama-mantg-egitimi
Layer快速入门, http://programming.discudemy.com/javascript/layui-layer
Interfacing LabVIEW With Arduino via LINX, http://programming.discudemy.com/robotics/labview-arduino-interfacing-labview-with-arduino-via-linx
The Complete Angular Course: Zero to Hero, http://programming.discudemy.com/angular/the-ultimate-angular-course
Compodoc: Crea documentación en proyectos Angular/Ionic/TS, http://programming.discudemy.com/angular/compodoc-crea-documentacion-en-angular-ionic
Internet das Coisas (IoT)  com Bluetooth 4.0, http://programming.discudemy.com/hardware/iotcomble
Get Started with Programming in C, http://programming.discudemy.com/programming-other/get-started-with-programming-in-c
Regex Academy: An Introduction To Text Parsing Sorcery, http://programming.discudemy.com/programming-other/regex-academy-an-introduction-to-text-parsing-sorcery
Learn what's new in PHP 7, http://programming.discudemy.com/php/php7-new-features
The Ultimate Guide: Learn Trello - Beginner to Advanced, http://programming.discudemy.com/development-tools/learntrelloatoz
Software QA Testing | The Complete Course, http://programming.discudemy.com/debug-test/software-qa-testing-the-complete-course
Python and Jupyter Notebooks for beginners, http://programming.discudemy.com/python/python-and-jupyter-notebooks-for-beginners
Os Fundamentos do Scrum, http://programming.discudemy.com/development-tools/os-fundamentos-do-scrum
C++ In 4 Stunden vom Anfänger zum Profi, http://programming.discudemy.com/cpp/cpp-in-4-stunden-vom-anfaenger-zum-profi
Fundamentos de la Programación, http://programming.discudemy.com/programming-other/como-empezar-a-programar-desarollar-en-cualquier-lenguaje
Programlamaya Giriş : HTML, http://programming.discudemy.com/html/programlamaya-giris-html
Ev3 Commands, http://programming.discudemy.com/development-tools/ev3-commands
Introducción a Git & GitHub, http://programming.discudemy.com/git/introduccion-a-git-github
Pre-Flutter & Dart: Everything To Know Before You Start!, http://programming.discudemy.com/programming-other/pre-google-flutter-and-dart-everything-you-need-to-know
Aprenda C e C++ - Fundamentos Para Lógica de Programação, http://programming.discudemy.com/cpp/c-e-c-fundamentos-para-logica-de-programacao
Build Your Own Amazing WordPress Website On A Budget, http://programming.discudemy.com/wordpress/build-your-own-wordpress-website
Python Hand-on Solve 200 Problems, http://programming.discudemy.com/python/python-handon
Beginner Local SEO | The Foundations of What Google Wants, http://programming.discudemy.com/seo/learn-beginner-local-seo
PHP Symfony FW ile Sıfırdan Gelişmiş Uygulama Geliştirme, http://programming.discudemy.com/php/php-symfony-framework-ile-sifirdan-gelismis-uygulama-gelistirme
Programador web: Cookies y Sesiones en PHP, http://programming.discudemy.com/php/programador-web-php-cookies-y-sesiones
Hoe maak je in 1 uur een volledig internetsite met WordPress, http://programming.discudemy.com/wordpress/hoe-maak-je-in-1-uur-een-volledig-internetsite-met-wordpress
Learn HTML in Urdu/Hindi, http://programming.discudemy.com/html/htmlurdu
Docker Containers For Beginners in DevOps (Hands-on Course), http://programming.discudemy.com/development-tools/docker-containers-for-beginners-ganesh-velrajan
Make WordPress Hosting Easy with Plesk on Google Cloud, http://programming.discudemy.com/wordpress/make-wordpress-hosting-easy-with-plesk-on-google-cloud
De Android a iOS - de Swift a Kotlin, http://programming.discudemy.com/android/de-android-a-ios-de-swift-a-kotlin
「PHP/MySQL　Cloud9&Xamppによる環境構築 (wordpressインストールまで)」, http://programming.discudemy.com/wordpress/phpmysql-wordpress
Android App & Admob Complete Earning Course, http://programming.discudemy.com/android/android-app-playstore-admob-earning-complete-course-urdu-hindi
Web Developer Basics, http://programming.discudemy.com/web-development-other/webbasics
Introdução ao Visual Basic.NET, http://programming.discudemy.com/programming-other/introducao-ao-visual-basicnet-para-iniciantes
Build An eCommerce Website With WordPress, http://programming.discudemy.com/wordpress/build-an-ecommerce-website
How To Create A Wordpress Website 2016 | NEW Divi Theme 3.0!, http://programming.discudemy.com/wordpress/how-to-create-a-wordpress-website-2016-new-divi-theme-30
C# .NET For Beginners, http://programming.discudemy.com/csharp/c-net-for-beginners
Quick SEO:  Search Engine Optimization Like a Pro, http://programming.discudemy.com/seo/quick-seo-search-engine-optimization-like-a-pro
Game Asset Creation With Houdini, http://programming.discudemy.com/game-development/game-asset-creation-with-houdini-c
SAP NetWeaver Fundamentals, http://programming.discudemy.com/programming-other/sap-netweaver-fundamentals
Docker Essentials, http://programming.discudemy.com/development-tools/docker-essentials
Java Quickstart: Ein erster Einblick in Java, http://programming.discudemy.com/java/java-quickstart-ein-erster-einblick-in-java-und-android-7
Cloud Firestore for iOS in Swift 5 Master Course, http://programming.discudemy.com/ios/cloud-firestore-for-ios-in-swift-5-master-course
SEO for Beginners, http://programming.discudemy.com/seo/seo-for-beginners-by-yoast
How to Design 3D Games in Buildbox 3 + Free Templates, http://programming.discudemy.com/game-development/design-3d-games-in-buildbox-3
El completo desarrollador de  iOS 10 - Crea apps con Swift 3, http://programming.discudemy.com/ios/el-completo-desarrollador-de-ios-crea-apps-con-swift
Unreal Engine 4 Fundamentos., http://programming.discudemy.com/game-development/unreal-engine-4-fundamentos
Diseña tu portafolio web con WordPress y Divi, http://programming.discudemy.com/wordpress/disena-tu-portafolio-web-con-wordpress-y-divi
Fundamental Coding(С++), http://programming.discudemy.com/cpp/fundamental-coding
Java for Beginners - Step by Step, http://programming.discudemy.com/java/java-for-beginners-step-by-step
Programação na Unity: (requisito) desenvolvedor 3D level 1, http://programming.discudemy.com/game-development/programacao-na-unity-requisito-desenvolvedor-3d-level-1
Kubernetes By Example, http://programming.discudemy.com/development-tools/kubernetes-by-example
Create a Subway scene in Unreal Engine 4, http://programming.discudemy.com/game-development/create-a-subway-scene-in-unreal-engine-4
Curso de Joomla 2.5 Paso a Paso, http://programming.discudemy.com/e-commerce/aprende-joomla
C# ile görüntü işleme eğitimi (C# image prosesing), http://programming.discudemy.com/csharp/goruntuisleme
Desarrollo de aplicaciones móvil android sin programación, http://programming.discudemy.com/android/creando-aplicacion-android-de-reconosimineto-de-voz
How to run Digital Marketing Ad Using Google Adwords Express, http://programming.discudemy.com/seo/digital-marketing-google-adwords-express-seo-ppc-advertising-2018
Java Programming Basics, http://programming.discudemy.com/java/java-programming-basics
Complete Java for Selenium & Appium, http://programming.discudemy.com/debug-test/complete-java-for-selenium-appium
Login with google plus using  CodeIgniter in Urdu/Hindi, http://programming.discudemy.com/php/login-with-facebook-using-codeigniter-in-urduhindi
Free 2018 Google Website - Quick Start Be Found Online Now, http://programming.discudemy.com/web-development-other/free-website-on-google-be-found-by-customers-at-no-cost
Introduction to iOS Dev in ObjC & Swift, http://programming.discudemy.com/ios/intro-to-ios-development
Create a Game Loop using C and SDL, http://programming.discudemy.com/game-development/game-loop-c-sdl
Automating Web/Mobile/API applications with TestProject, http://programming.discudemy.com/debug-test/testproject
Tarefas do Dia a Dia de um DBA - Gerenciamento de Acesso, http://programming.discudemy.com/sql/tarefas-do-dia-a-dia-de-um-dba-gerenciamento-de-acesso
SAP CPI: Overview of SAP Cloud Platform Integration, http://programming.discudemy.com/programming-other/overview-of-sap-cloud-platform-integration-cpi
How to Make a Video Blog Website From Scratch w/ Wordpress , http://programming.discudemy.com/wordpress/how-to-make-a-video-blog-website
Descubre SpeechRecognizer en App Inventor, http://programming.discudemy.com/development-tools/descubre-speechrecognizer-en-app-inventor
Fundamentals of Programming using Python 3, http://programming.discudemy.com/python/fundamentals-of-programming-using-python-3
WordPress Webseite erstellen mit Beaver Builder & Astra, http://programming.discudemy.com/wordpress/wordpress-webseite-erstellen-wordpress-beruf
Try Django 1.11 // Python Web Development, http://programming.discudemy.com/django/try-django-v1-11-python-web-development
Creating and working with automation test report using EARS, http://programming.discudemy.com/debug-test/creating-automation-reports-with-ears
Creación de Geoportales en Tiempo Real con ArcGIS, http://programming.discudemy.com/development-tools/geoportales
Learn Scratch 3 from beginner to advanced, http://programming.discudemy.com/game-development/learn-scratch-3-from-beginner-to-advanced
Bitfountain Objective-C for iOS 9 , http://programming.discudemy.com/ios/bitfountain-objective-c-for-ios
Mastering Basic CSS Selectors., http://programming.discudemy.com/css/mastering-basic-css-selectors
Houdini Tech Art  - Vertex Density Heatmap, http://programming.discudemy.com/game-development/houdini-tech-art-vertex-density-heatmap
Complete Data Science Course: Go from zero to hero, http://programming.discudemy.com/programming-other/complete-data-science-course-go-from-zero-to-hero-h
Introducción al desarrollo de temas WordPress, http://programming.discudemy.com/wordpress/introduccion-desarrollo-temas-wordpress
Understanding Bootstrap Grids and Columns, http://programming.discudemy.com/bootstrap/understanding-bootstrap-grids-and-columns
Introduction to X Theme and Cornerstone for Wordpress, http://programming.discudemy.com/wordpress/intro-to-x-theme-cornerstone-for-wordpress
Learn Kotlin By Making Android App, http://programming.discudemy.com/android/learn-kotlin-by-making-android-app
Introduction to Internet of Things Using Raspberry Pi, http://programming.discudemy.com/development-tools/introduction-to-internet-of-things-u
Stairway to Scala - Setup Instructions, http://programming.discudemy.com/programming-other/stairway-to-scala-setup-instructions
Introdução a linguagem de programação python, http://programming.discudemy.com/python/introducao-programacaopython
Install Wordpress Locally & Move Website Online, http://programming.discudemy.com/wordpress/install-wordpress-locally-move-localhost-website-online
Unity: 2D Game Development, http://programming.discudemy.com/game-development/2d-game-development-for-unity
Función "mail" de PHP: Aprende a enviar emails con PHP, http://programming.discudemy.com/php/enviar-email-con-php
Pengenalan Cloud Computing, http://programming.discudemy.com/development-tools/pengenalan-cloud-computing
Temel Spring Framework Eğitimi, http://programming.discudemy.com/java/spring-framework
Ferramentas e dicas matadoras para o desenvolvimento Magento, http://programming.discudemy.com/e-commerce/ferramentas-e-dicas-para-magento
Learn how to create a WordPress theme using Pinegrow, http://programming.discudemy.com/wordpress/learn-how-to-create-a-wordpress-theme-using-pinegrow
Learn Python From Scratch, http://programming.discudemy.com/python/learn-python-from-scratch-w
Omnis Academy, http://programming.discudemy.com/development-tools/omnis-academy
Introducción a la Programación con Python, http://programming.discudemy.com/python/introduccion-a-la-programacion-con-python-juan-de-la-torre
Introduction to Dell Boomi, http://programming.discudemy.com/development-tools/introduction-to-dell-boomi-ipaas
Curso Haskell para Iniciantes, http://programming.discudemy.com/programming-other/curso-haskell
Aprende SQL desde CERO hasta AVANZADO como un PROFESIONAL., http://programming.discudemy.com/sql/aprende-sql-desde-cero-hasta-avanzado-como-un-profesional
Java básico, http://programming.discudemy.com/java/java-basico-d
Python Regular Expressions With Examples, http://programming.discudemy.com/python/python-regular-expressions-with-examples
Create a Professional Website for Your Business (Wordpress), http://programming.discudemy.com/wordpress/create-professional-website-business
REST WCF Service in ASP.NET, http://programming.discudemy.com/web-development-other/rest-wcf-service-in-aspnet
Kodlama Öğreniyorum, http://programming.discudemy.com/programming-other/kodlama-ogreniyorum
Learn the basics of Programming with C++, http://programming.discudemy.com/cpp/learn-c_plus-with-real-world-examples
​​Poznaj ​Bootstrap 4- Sass i stwórz ​PRAKTYCZNY PROJEKT, http://programming.discudemy.com/bootstrap/kurs-bootstrap-sass
Learn OBIEE 12C Part 1 of 6, http://programming.discudemy.com/sql/obiee-12c
Programação para Iniciantes em 3 horas (ou menos), http://programming.discudemy.com/programming-other/programacao-para-iniciantes-aprenda-programar-do-zero
Hasan Yüksektepe ile Wordpress Eklentisi Geliştirme, http://programming.discudemy.com/wordpress/hasan-yuksektepe-ile-wordpress-eklentisi-gelistirme
Introduction to Android Volley Programming, http://programming.discudemy.com/android/introduction-to-android-volley-programming
Limbajul de programare C++, http://programming.discudemy.com/cpp/limbajul-de-programare-cplusplus
Learn Python: Build a Virtual Assistant, http://programming.discudemy.com/python/learn-python-build-a-virtual-assistant-in-python
Apache Kafka and Spring Boot (Consumer- Producer), http://programming.discudemy.com/java/apache-kafka-and-spring-boot-consumer-producer
Getting Started with ArangoDB, http://programming.discudemy.com/sql/getting-started-with-arangodb
Créez votre premier site web Responsive en HTML et CSS, http://programming.discudemy.com/html/3-h2prog-pour-creer-son-premier-site-web-en-html-et-css
iOS9 Apple Watch Toolkit: Make Real Apps From Scratch, http://programming.discudemy.com/ios/the-complete-apple-watch-course-make-real-apps-from-scratch
Reskin an iOS App, http://programming.discudemy.com/ios/how-to-reskin-an-app-free-tutorial
REST API Testing using SOAP UI - Quick Introduction, http://programming.discudemy.com/development-tools/rest-api-testing-using-soap-ui-quick-introduction
A'dan Z'ye Bootstrap 4, http://programming.discudemy.com/bootstrap/adan-zye-bootstrap-4-egitimi
Ultimate Marketing and Selling Course, http://programming.discudemy.com/seo/ultimate-marketing-and-selling-course
Tarefas do Dia a Dia de um DBA - Alertas no SQL Server, http://programming.discudemy.com/sql/tarefas-do-dia-a-dia-de-um-dba-alertas-no-sql-server
Learn How To Build A Professional Web Site By Using Joomla, http://programming.discudemy.com/e-commerce/learn-how-to-build-a-professional-web-site-by-using-joomla
Getting Started With Software Testing  Context and Basics, http://programming.discudemy.com/debug-test/getting-started-with-software-testing-context-and-basics
Git e Github para iniciantes, http://programming.discudemy.com/git/git-e-github-para-iniciantes
Beginners guide to RPA - Automation Anywhere, http://programming.discudemy.com/robotics/beginners-guide-to-rpa-automation-anywhere
Aprenda Kotlin do zero - Módulo Básico, http://programming.discudemy.com/android/kotlin-aprenda-do-zero-modulo-basico
Laravel para principiantes - Da los primeros pasos, http://programming.discudemy.com/php/laravel-para-principiantes
Learn Android Wear Programming, http://programming.discudemy.com/android/learn-android-wear-programming
Real Time Mesajlaşma  Uygulaması, http://programming.discudemy.com/android/real-time-mesajlasma-uygulamas
Start a Programming Career Military Style, http://programming.discudemy.com/programming-other/starting-a-programming-career-military-style
Emmet in Visual Studio Code: Accelerate your HTML workflow, http://programming.discudemy.com/html/emmet-in-vscode
Linked lists for absolute beginners, http://programming.discudemy.com/nodejs/linked-lists-for-absolute-beginners
ISEE Upper Level Overview and Strategies Course, http://programming.discudemy.com/debug-test/isee-upper-level-overview-and-strategies-course
Cómo hacer un Blog GRATIS con Wordpress - CREA TÚ BLOG HOY, http://programming.discudemy.com/wordpress/como-hacer-un-blog-gratis-wordpress-crear-blog
CSS Box Model Padding Margins Borders, http://programming.discudemy.com/html/css-box-model-padding-margins-borders
Design and Implementation using FPGA for beginners, http://programming.discudemy.com/robotics/design-and-implementation-using-fpga-for-beginners
Python: Your way into the programming world (Arabic version), http://programming.discudemy.com/python/python-your-way-into-the-programming-world-arabic-version
Curso de Joomla 3 "Mi primer proyecto con Joomla", http://programming.discudemy.com/e-commerce/curso-de-joomla-3-5-mi-primero-proyecto-con-joomla
How To Setup Web Hosting, http://programming.discudemy.com/web-development-other/how-to-setup-web-hosting
JavaScript : JavaScript Awesomeness, http://programming.discudemy.com/javascript/javascript-javascript
Learn Angular From Scratch, http://programming.discudemy.com/angular/learn-angular-from-scratch-b
EverWeb Website  Builder, http://programming.discudemy.com/web-development-other/everwebcourse
Make a Wordpress Portfolio Website, http://programming.discudemy.com/wordpress/make-a-wordpress-portfolio-website
Database Design, http://programming.discudemy.com/sql/database-design
60 Minute Python Crash Course - Building a Solid Foundation!, http://programming.discudemy.com/python/60-minute-python-crash-course-building-a-solid-foundation
SAP LSMW Made Simple, http://programming.discudemy.com/programming-other/sap-lsmw-made-simple
